,Unnamed: 0,Unnamed: 0.1,Unnamed: 0.1.1,Unnamed: 0.1.1.1,sent1,sent2,ending0,ending1,ending2,label
3447,2701,2701,2701,2701,Aubrey told Quinn the time to get ready and the time to take a break.,How would Quinn feel as a result?,informed,sad,not lazy,0
3448,1421,1421,1421,1421,Taylor learned karate and was one of the best in class.,How would you describe Taylor?,immature,hardworking,lazy,1
3449,413,413,413,413,Taylor worked overtime and created a more efficient system for Jordan.,How would Jordan feel as a result?,like cancelling the project,embarrassed,accomplished,2
3450,2025,2025,2025,2025,"Jesse's friend threw a surprise party for Jesse.  Therefore, Jesse showed their appreciation.",What will Others want to do next?,clean after the party to help Jesse,make sure that they have a good time,left after the party without helping,1
3451,3358,3358,3358,3358,Addison ran a mile and then took a long rest and recovered from the race.,What does Addison need to do before this?,eat junk food,get ready to run,be lazy,1
3452,2960,2960,2960,2960,Alex took care of people as part of their job in nursing and was very caring toward the patients.,How would patients feel as a result?,like Alex ignores them,like Alex hates them,like Alex understands them,2
3453,3665,3665,3665,3665,kendall opened remy's gift and it turned out to be exactly what they were hoping for.,What will kendall want to do next?,hate the gift,enjoy the gift,ignore remy,1
3454,4387,4387,4387,4387,Austin had a business meeting that afternoon. Austin met the client's for lunch.,What will happen to Austin?,make the deal,cancel the lunch,leave the clients behind,0
3455,4846,4846,4846,4846,Ash used a model to represent the story of his family tree.,How would you describe Ash?,thoughtful,boring,lazy,0
3456,616,616,616,616,Addison performed their duty to the best of their abilities.,What will Addison want to do next?,be useless,be weak,be perfect,2
3457,4856,4856,4856,4856,Kendall decided to go to a new city to get a better job for themselves.,How would Kendall feel afterwards?,sad,accomplished,bored,1
3458,234,234,234,234,Remy passed them quickly and took first place in the marathon after training for months.,How would you describe Remy's abilities?,unwell and sickly,weak and untrained,athletic and fit,2
3459,4255,4255,4255,4255,Aubrey painted their house with a mural depicting mountains with a beautiful sunset in the background.,How would you describe Aubrey?,creative,terrible at painting,bad at art,0
3460,591,591,591,591,Riley got Robin a business opportunity that would make her a lot of money.,What will happen to Robin?,go shopping and show up late for the interview,go out partying and show up reeking of alcohol,groom well to make sure she gets the client,2
3461,2789,2789,2789,2789,Aubrey gathered around Kendall to discuss the plans for the big project.,What will Aubrey want to do next?,help organize the project,passive,rich,0
3462,3627,3627,3627,3627,Riley helped Kendall discover something new when they were working with fossils.,What does Riley need to do before this?,know how to find fossils,avoid artifacts,cancel plans,0
3463,1450,1450,1450,1450,Robin performed all of their duties and was hopeful she would get the promotion.,Why did Robin perform all of their duties?,avoid detection,be recognized,quit her job,1
3464,321,321,321,321,Kendall waved their hand back at the crowd when they cheered.,How would Others feel as a result?,That she hated them,Like they were appreciated,Very lonely,1
3465,3108,3108,3108,3108,Casey crunched numbers and was an effective accountant for his clients.,How would Others feel as a result?,unsure and untrusting,motivated to fire him,pleased with his services,2
3466,1914,1914,1914,1914,Casey suits Jan's taste so she offered her the job.,How would Jan feel as a result?,without out power,angry about the offer,hopeful she would accept,2
3467,1344,1344,1344,1344,Remy represented Skylar's interests while they were away on vacation.,How would Remy feel afterwards?,like a bad friend,irresponsible,responsible,2
3468,3103,3103,3103,3103,Aaron was applying to nursing school and asked Lee for a recommendation letter.,What did Aaron need to do before this?,finish the nursing prerequisites,as jealous,as envious,0
3469,3249,3249,3249,3249,Casey kept it real. Her friends were very grateful and let Casey know it.,How would Casey feel afterwards?,indifferent,appreciated,neglected,1
3470,1556,1556,1556,1556,Jesse sought Sasha's explanation because they were very experienced in the field.,Why did Jesse do this?,get an expert's opinion,pawn off the work,be lazy,0
3471,2204,2204,2204,2204,Taylor reached Alex's hand with her own because they loved each other.,Why did Taylor do this?,be unloved,not show affection,show affection,2
3472,3006,3006,3006,3006,Sasha sent the information along to Jesse's way so he could be in the loop.,What will happen to Jesse?,be left out,be more informed,be left behind,1
3473,4564,4564,4564,4564,Quinn gave Austin detention so they would learn a lesson about what they did.,What will happen to Quinn?,hope they learn,refuse to accept detention as a valid punishment,come to resent Quinn for punishing them,0
3474,4243,4243,4243,4243,Ash tried Addison's hardest puzzle in order to prove herself.,How would Ash feel afterwards?,Like a loser,lazy,Accomplished,2
3475,4933,4933,4933,4933,Ash got Cameron's mom the perfect present just in time for the party.,How would Cameron feel about finding the present?,unsure and uneasy,prepared and thoughtful,unprepared and unaware,1
3476,2285,2285,2285,2285,Skylar needed to get a job so he could pay for all his bills.,What will Skylar want to do next?,play video games,make a resume,lose their previous job,1
3477,511,511,511,511,Sydney was responsible for cropping all photographs submitted by clients.,How would you describe Sydney?,argumentative,mean,competent,2
3478,3208,3208,3208,3208,Casey was prepared for Cameron's emergency when it finally happened that day.,How would you describe Casey?,very prepared,very lazy,quite selfish,0
3479,4279,4279,4279,4279,addison called the customer into skylar's office to help them with their problem and do their job.,What will happen to Addison?,be ignored,be hated,be appreciated,2
3480,2371,2371,2371,2371,Sydney sung together and they impressed the crowd with their great talent.,What will Others want to do next?,lazy,cheer,conflicted,1
3481,1706,1706,1706,1706,Tracy got some rest and mentally prepared themselves for the lengthy ceremony the following day.,How would Tracy feel afterwards?,rested and ready,like napping after the ceremony,taking a break mid ceremony,0
3482,2697,2697,2697,2697,"Wanting to improve their overall test scores, Kai taught students the math lesson.",What will happen to Others?,confused,Others will be better equipped to handle math problems,stupid,1
3483,2256,2256,2256,2256,Austin worked his fingers to the bone in order to set a good example to others.,How would Others feel as a result?,worthless,lazy,motivated,2
3484,3863,3863,3863,3863,jordan wanted to help lee so she got his things.,What will happen to Jordan?,he will be hated,he will be appreciated,he will be resented,1
3485,3280,3280,3280,3280,jordan always kept his end of the deal so he held up his end of the deal.,What will Jordan want to do next?,have the other party keep their word,refuse to care about the deal,forget about the deal,0
3486,4035,4035,4035,4035,Bailey discussed this matter in detail with her supervisor who gave her good advice on dealing with the situation.,What will Bailey want to do next?,Ignore the advice given by her supervisor,listen to bailey,Make a plan to handle the situation,2
3487,4822,4822,4822,4822,Sydney made the cake special for the birthday party.,How would Sydney feel afterwards?,heartless,cruel,Accomplished,2
3488,2382,2382,2382,2382,Carson took the advice to heart. Carson was successful using the advice he got.,How would Carson feel afterwards?,incompetent,accomplished,superficial,1
3489,2691,2691,2691,2691,Ash asked the store if they could send them some items for a wedding.,What will Others want to do next?,go away,prepare the items,rent a boat,1
3490,2524,2524,2524,2524,riley wanted to have a good time so he prepared for the recception.,What will Riley want to do next?,forget about the reception,prepare for the reception properly,stay home,1
3491,4847,4847,4847,4847,Carson made sure his friends choose the destination he wants to go to. Carson always got their way.,How would Carson feel afterwards?,happy that he got what he wanted,unhappy that they listened to him,upset that he got what he wanted,0
3492,704,704,704,704,Kai exchanges insurance information with them in exchange for money as per the agreement.,What will happen to Kai?,become poor,be calm,deliver the information,2
3493,1164,1164,1164,1164,Ash spent extra time at work to make sure they got all their work done.,Why did Ash do this?,make sure they did well,be a bad employee,make sure they did poorly,0
3494,21,21,21,21,Sydney got a raise and a new promotion.,What does Sydney need to do before this?,be bad at her job,do a good job,be lazy,1
3495,2068,2068,2068,2068,Ash received positive feedback for his hard work on the assignment.,What will Ash want to do next?,express disgust,quit working hard,continue the good work,2
3496,3107,3107,3107,3107,Lee developed students aptitude by being an effective teacher.,What will happen to the students?,get bad grades,learn the material,flunk out of school,1
3497,3592,3592,3592,3592,Robin held a four leaf clover at the contest winner announcement to receive good luck.,Why did Robin do this?,leave the area,lose the contest,get a good result,2
3498,2212,2212,2212,2212,Jordan expressed his appreciation to the people who made his award possible.,Why did Jordan do this?,show that he cared,make people sad,get people angry,0
3499,3602,3602,3602,3602,Jan performed well on the test.,What will happen to Jan?,The others will fail the test,get a good grade,wil fail,1
0,1546,1546,1546,1546,Casey filled Sydney's heart with jealousy after he started dating someone.,What will happen to Sydney?,become friends,be happy with a new love,hate each other,2
1,3292,3292,3292,3292,Addison let Casey win because Casey always complained when Addison won and beat her.,What does Addison need to do before this?,play badly so Casey would win,play their best to beat Casey,cheer,0
2,448,448,448,448,Austin had a snowball fight with his family on the first day of snow.,How would his family feel as a result?,happy it's winter,longing for summer,scared of snowballs,0
3,268,268,268,268,Addison put Kendall's  cost-cutting ideas into action.,What will happen to Addison?,kendall will be thanked,get promoted,lose their job,1
4,2084,2084,2084,2084,Skylar was offered a high paying position in her field of expertise. She quit her old job.,How would Skylar feel afterwards?,excited to begin her dream job,angry about the new position,happy to keep her old job,0
5,2195,2195,2195,2195,skylar was sick so she took a vacation and spent the next week at home.,How would Others feel as a result?,upset,angry,relaxed,0
6,2455,2455,2455,2455,Kendall also said the secret to the group of people that were listening.,How would you describe Kendall?,proud to of shared a secret,mean,helpful,1
7,1472,1472,1472,1472,"Tracy was not very good at playing poker, so Tracy tipped his hand.",What will Tracy want to do next?,decide their new strategy,fold,challenge the winner,1
8,2903,2903,2903,2903,Cameron would make fun of Austin often because Austin always fell down while walking.,What will Austin want to do next?,say they were sorry,work on walking,apologize to them,1
9,3698,3698,3698,3698,kai was a persistent person who did not give up easily so he finally made headway.,What will Kai want to do next?,achieve an accomplishment,keep working,stop making headway,1
10,3008,3008,3008,3008,quinn wanted to punish jesse so she took away his video games.,What will Jesse want to do next?,harass quinn,beg quinn to give him back his video games,hide them,1
11,4398,4398,4398,4398,A man asked Jordan if he could give him any money.,What will Jordan want to do next?,unlock his doors,ignore the person,didn't do anything,1
12,4541,4541,4541,4541,Remy sold Carson's jacket at a reasonable price after buying it for a low price.,What will happen to Carson?,be wealthy,be happy,be annoyed,1
13,4543,4543,4543,4543,Taylor impressed upon Casey the rules of the game so he would know them.,What will Others want to do next?,follow the rules,break the rules,learn the rules of the game,0
14,3644,3644,3644,3644,Lee fell asleep in the car while his friend was driving.,How would you describe Lee?,sleepy,awake,funny,0
15,3286,3286,3286,3286,bailey made sasha's coffee but put poison in it to get rid of sasha.,What will happen to Sasha?,be dead,get arrested,be healthy,0
16,1906,1906,1906,1906,Ash played some tricks on the people that were living with him.,How would Others feel as a result?,played as fools,sorry for the people,ashamed about the pranks,0
17,124,124,124,124,Jesse saw her friend Ash's boyfriend behind Ash's back for several months.,How would you describe Jesse?,a caring person,ignorant of boundaries,cheated,1
18,2997,2997,2997,2997,Addison and Jesse put an end to Riley once and for all.,What will Jesse want to do next?,run away,consult with Jesse on what to do next,help Jesse cover their tracks,0
19,3597,3597,3597,3597,Robin brought Remy to trial once the evidence had all been gathered.,Why did Robin do this?,gather the evidence,punish Remy,be a good friend to Remy,1
20,3375,3375,3375,3375,jordan brought the food to sasha at the end of the line because they felt bad for sasha.,How would Sasha feel as a result?,sad about the gesture,annoyed by jordan,grateful towards jordan,2
21,1517,1517,1517,1517,Remy rehearsed Quinn's lines. Then she told Quinn that he didn't get the part.,How would Quinn feel as a result?,not happy,somewhat clever,somewhat incompetent,0
22,98,98,98,98,Aubrey made Kendall's bed because Kendall did not do it.,How would you describe Aubrey?,unaccomplished,responsible,guilty,1
23,206,206,206,206,Tracy had goals of retiring young. Tracy started a business.,Why did Tracy do this?,retire right now and stop the business,make lots of money,start a business and stop it at a young age,2
24,902,902,902,902,Sydney was home alone for the first time and thought she heard someone outside the window.,How would you describe Sydney's personality?,a brave person,a scared person,a happy person,1
25,1431,1431,1431,1431,Austin got full at dinner but saved room for dessert.,What will Austin want to do next?,like dessert,eat breakfast next,full next,0
26,1633,1633,1633,1633,"Taylor played everyday, and ignored their studies, and got kicked out of school.",How would you describe Taylor?,terrible,someone who likes to have a good time,bad,2
27,623,623,623,623,Jan played volleyball in high school and continued playing through college.,How would you describe Jan?,a inquisitive person,competitive person,fit,1
28,819,819,819,819,"Jesse brought the show to a close with an uplifting, crowdpleasing number that received a standing ovation.",How would Jesse feel afterwards?,talented,ready to perform an encore,curious about the song selection,0
29,3927,3927,3927,3927,Riley faced an uneasy future after they learned they might be fired from their job.,How would Riley feel afterwards?,worried about their job,secure,anxious,2
30,2498,2498,2498,2498,Robin was being really morbid and dragging down the group. Robin cast a shadow over everyone.,How would you describe Robin?,depressing,apathetic about their feelings,uncaring about their feelings,0
31,4327,4327,4327,4327,Remy had a dentist appointment that was too far away for them to walk to.,What does Remy need to do before this?,needed to leave on time,call for a cab ride to the dentist,needed to take the bus instead,1
32,4578,4578,4578,4578,"Although Robin wished to remain at the party for a while longer, Kai needed to leave and didn't have a ride so Robin took Kai home.",What will Robin want to do next?,invite Kai into their home,thank Kai for the favor,return to the party,2
33,1620,1620,1620,1620,tracy was busy so she accidentally pressed upon austin in the elevator.,What does Tracy need to do before this?,get out of the elevator,be busy,avoid the elevator,1
34,501,501,501,501,Robin gave them money and they went to the cafe for some lunch.,How would Others feel as a result?,full now,a generous person,bored now,0
35,3447,3447,3447,3447,Sydney invited their friends over to have a house party.,What does Sydney need to do before this?,Buy food,socialize with their friends,show off their home,0
36,1963,1963,1963,1963,Jesse talked to Casey about anything interesting but Casey didn't listen at all.,What will happen to Jesse?,yell at Casey,leave the conversation,ignore the conversation,1
37,4758,4758,4758,4758,Quinn could not pass any homework or test in his physics class.,What will Quinn want to do next?,move to any easier science class,change his major to physics,start helping other students understand the homework,0
38,1231,1231,1231,1231,Sasha went shopping with their father and he refused to let her pay for anything.,What will happen to Sasha?,a provider,think her father old fashioned,get new things,2
39,2987,2987,2987,2987,Carson gave Addison a piece of their mind.  Addison talked badly about Carson behind their back.,What will happen to Addison?,walk away from Carson,have no friend,find new friends,1
40,64,64,64,64,"Ash was worried how it would go, but according to Ash it went well.",What does Ash need to do before this?,Relax to reduce stress,do a good job,Avoid the event,1
41,4070,4070,4070,4070,Jordan lent Addison the money so she could pay for groceries.,What will happen to Addison?,get repaid,get angry with him,have food to eat,2
42,3378,3378,3378,3378,Alex ran home scared after seeing a creepy guy hiding in the shadows.,What will Alex want to do next?,look out the window to be sure they weren't forgotten,lock all the doors,need to run fast,1
43,1636,1636,1636,1636,Sasha choked on their food while she was in the deli.,What will Sasha want to do next?,enter the deli and eat food,eat more food,spit the food out,2
44,3467,3467,3467,3467,Tracy laughed and told the joke about the chicken and the chicken owner.,What will Others want to do next?,in awe,lazy,Asked if it was offencive,2
45,4083,4083,4083,4083,Sydney took both of Skylar's kids to the movies and they watched something great.,What will Skylar want to do next?,get popcorn,take Skylar's kids home,ask Skylar's kids if they enjoyed the movie,1
46,4941,4941,4941,4941,Taylor put the story another way so the students will have better understanding.,What will Others want to do next?,make sure they understand,ask questions,thank Taylor for the book,1
47,2174,2174,2174,2174,Cameron was playing with blocks when his brother came and pushed them over. Cameron hit their brother for messing it up.,What does Cameron need to do before this?,punish them,yell at them,needed to be playing,2
48,1964,1964,1964,1964,Jesse is Robin's best friend. Jesse keeps Robin balanced.,How would Robin feel as a result?,affectionate toward Jesse,like a failure,thankful for her friend,2
49,1203,1203,1203,1203,Jan decided to ring the door bell because her husband wouldn't answer and her maid hated her.,How would Jan feel afterwards?,bad that her husband hated her,bad that her maid hated her,thoughtful,1
50,4501,4501,4501,4501,Addison noticed that Austin didn't finish writing the song so she finished it for him.,How would Addison feel afterwards?,nervous about singing the song,proud because she completed a song,bad because she finished the song,1
51,3664,3664,3664,3664,Sasha stated the findings given in the report briefly before dismissing everyone for lunch.,How would Others feel as a result?,hungry and grateful,uninformed and forsaken,satiated and annoyed,0
52,962,962,962,962,Cameron told his best friend his closest secret that he had kept hidden.,What will Cameron want to do next?,ask their friend to keep the secret,see the friend's reaction,see the friend's mystery,0
53,590,590,590,590,Alex is a professional athlete.  He bet some strangers that he could win a race and won.,What will the strangers want to do next?,ask Alex for the money he owes them,place a bet before the race begins,get their money back from Alex,2
54,3085,3085,3085,3085,Austin quickly performed CPR and chest compressions on Quinn after she suddenly collapsed from a heart attack.,What will Quinn want to do next?,Call an ambulance,seek immediate medical attention,be left to die,1
55,3787,3787,3787,3787,Ash grounded Kai for a month because Kai called Ash a bad word.,What will happen to Kai?,be thanked,not be allowed to have fun,be angry,1
56,4012,4012,4012,4012,Alex invited their friend Cameron to the party even though nobody likes Cameron.,Why did Alex do this?,be nice,be mean,tell cameron it's fine,0
57,2108,2108,2108,2108,"Casey was getting very impatient, so Alex kept him occupied.",How would Alex feel afterwards?,please with Casey,sad about it,happy about it,2
58,1136,1136,1136,1136,Austin left for a trip and carried Casey along the way.,Why did Austin do this?,have a friend there,enjoy the trip,stay with Casey,0
59,2689,2689,2689,2689,riley was about to give up but then she turned things around.,How would the audience feel as a result?,like standing and clapping,like booing her,Like they are motivated,0
60,603,603,603,603,Lee felt cramped on Jan's line and had to call later that day.,How would Jan feel as a result?,would be annoyed,upset,sad now,0
61,1857,1857,1857,1857,After Carson cut his hand Bailey layered it with bandages to stop the bleeding.,What will Bailey want to do next?,take Carson to the doctor,layer Carson's other hand,clean the wound,0
62,1785,1785,1785,1785,"Because they are breaking up, Skylar met Alex for the last time to return their things.",Why did Skylar do this?,and Alex are no longer dating,and Alex are no longer friends,Take his things home,0
63,2292,2292,2292,2292,Quinn put their foot down when their girlfriend wanted to buy another purse at the store.,How would you describe Quinn?,worried about their girlfriend,worried about finances,happy,1
64,4152,4152,4152,4152,Kendall just got some bad news from their mother. Kendall and Aubrey are best friends. Kendall called Aubrey to tell them the bad news. Aubrey would see tears in Kendall's eyes.,What will Aubrey want to do next?,hug Kendall,ask Aubrey to comfort her,tell the rest of the family the bad news,0
65,4698,4698,4698,4698,Tracy heard a knock on their door in the mid night with big snow storm outside.,How would you describe Tracy?,cautious,scared,sentimental,1
66,4772,4772,4772,4772,Robin gave Casey a blow horn but Casey did not know how to use it.,What does Robin need to do after this?,learn the blow horn,show Casey how to use it,show Casey how to use the gift,1
67,4732,4732,4732,4732,Sydney accidentally left her food at home and had no lunch.,How would you describe Sydney?,eat when she gets home,accidentally left her food at home,hungry without lunch,2
68,3145,3145,3145,3145,"Skylar was not willing to get a new job, so Austin helped Skylar change their ways.",What will Austin want to do next?,get Skylar to pay their own way,force Skylar to get a job,help Skylar get a job,2
69,2197,2197,2197,2197,"Tracy was always good at math, but she was so uncoordinated.",How would you describe Tracy?,a star athlete,a math nerd,clumsy and unbalanced,1
70,1923,1923,1923,1923,Sasha lost control of the car and crashed but was able to get out of the car and use their phone.,What will Sasha want to do next?,avoid using the phone,drive the car,call the police,2
71,3024,3024,3024,3024,Robin took her leather purse with her down the waterslide.,How would you describe Robin?,thoughtful for taking her things with her so they won't get lost,stupid,thoughtless for taking a bag where it will likely get lost,1
72,3273,3273,3273,3273,Carson called them to account about the terrible murder that just happened.,What will Carson want to do next?,strong,was upset,bored,1
73,3794,3794,3794,3794,Tracy didn't catch any fish after attempting to do so for 7 hours straight.,How would Tracy feel afterwards?,incompetent,deft,Bad about herself,0
74,4087,4087,4087,4087,"Jesse wanted a new game, but he didn't have enough money to pay for it.",What does Jesse need to do before this?,he forgot he needed money,he did not have a job,work for the money,2
75,3982,3982,3982,3982,Austin made the announcement to his wife Addison that he wanted a divorce.,What will happen to Austin?,agree to the divorce and move on,leave his wife,be sad and wonder what went wrong,1
76,1729,1729,1729,1729,Bailey happily accepted the car even though they had a car that was fine.,How would you describe Bailey?,pleased with a new vechile,an extravagant person,a simple person,0
77,4675,4675,4675,4675,Kendall went against the grain and did what they thought was right.,What does Kendall need to do before this?,think about their best,right,be a moral person,2
78,2367,2367,2367,2367,Tracy could not get the position on their own so Skylar afforded them the opportunity.,What will Skylar want to do next?,Tell Tracy to leave,lp Tracy get started,Avoid interacting with Tracy,1
79,2668,2668,2668,2668,Sasha touched them self when she was alone in her room.,Why did Sasha do this?,get ill,good,gross herself out,1
80,930,930,930,930,"Skylar put food in Ash's car, knowing Ash wouldn't have time to stop for lunch during the long drive.",How would Ash feel as a result?,Disappointed to have no food,Very grateful and relieved,Hungry and sad,1
81,3000,3000,3000,3000,Taylor always studied as hard as they could during the week. Taylor got great grades in school.,What does Taylor need to do beforehand?,graduate and get a great job,be at home,be in school,2
