,Unnamed: 0,Unnamed: 0.1,Unnamed: 0.1.1,Unnamed: 0.1.1.1,sent1,sent2,ending0,ending1,ending2,label
0,1086,1086,1086,1086,Jesse found the house in the woods after month of trying to locate the house.,What will Jesse want to do next?,search the woods,buy a new house,take pictures of the house,2
1,1146,1146,1146,1146,Ash was cooking dinner for their best friend so Ash spent extra time on making it delicious.,How would you describe Ash?,interested in their friend's opinion,proud of their cooking,a good friend,2
2,1851,1851,1851,1851,according to the article Cameron saw Casey this morning.,What will Cameron want to do next?,say hello,give a hug,be friendly,0
3,2138,2138,2138,2138,Carson led Jan to start exercising and eating better and it led Jan's life to be better.,What will happen to Carson?,be in better shape,start preparing the daily affirmations,begin jogging with Jan every day,2
4,215,215,215,215,"Alex lived nearby in Casey's area, away from the gated community.",What will happen to Casey?,be visited by Casey in the slums,see the gated community from afar,understand Alex,1
5,4836,4836,4836,4836,Carson was trying to be quiet in the quiet room but accidently made a noise.,What does Carson need to do before this?,cough in his hands,Remove their socks,Walk quieter,2
6,4931,4931,4931,4931,Sasha told Quinn to meet up with them at the mall after school.,How would you describe Sasha?,As someone who saw their friend while walking in the mall,As someone that shopped at the mall,hang out with their friend,1
7,2542,2542,2542,2542,Austin had eyes bigger than his stomach. Austin mom always has been worried about Austin eyes. She told him need to see a professional.,What will Others want to do next?,make an appointment,check his eyes,research doctors,1
8,468,468,468,468,Quinn planned to move his furniture but needed Alex's help to complete the task.,What will happen to Quinn?,come over to help,asks if Alex can help,sweat from lifting furniture,1
9,1879,1879,1879,1879,Remy found an appropriate place in the right location.,What does Remy need to do before this?,Redecorate the place,Search real estate listings,organise the next event,1
10,2894,2894,2894,2894,"Seeing that he was very sick and not himself, Jan took her cat to the veterinarian.",What will Jan want to do next?,get a new cat,Put her cat in a carrier,get a diagnosis,2
11,1642,1642,1642,1642,Jordan was quick and prevented Kendall from falling down when she tripped.,What will happen to Kendall?,serve Jordan,be more careful,be loved,1
12,3544,3544,3544,3544,Robin saw a broadway show and enjoyed it very much.,What does Robin need to do before this?,buy tickets to see it again,post about it on social media,go to the show before this,2
13,4730,4730,4730,4730,Remy reached the Earth's equator after several days at sea.,What does Remy need to do before this?,take a boat south,take photos,post on social media,0
14,3879,3879,3879,3879,"Jan opened a store, but no one ever came, and it quickly closed down.",What will Jan want to do next?,closed the store due to lack of customers,closed the store because business was very slow,try a different store,2
15,3746,3746,3746,3746,Ash gave worry to problems about the growing problem of not getting enough to eat.,What will Ash want to do next?,let her mom know that she needed more to eat,smart,tell her mom that she needed more money for lunch because she was hungry,0
16,924,924,924,924,Quinn visited their doctor to get blood work done to make sure she didn't have cancer.,What will Quinn want to do after?,hear good news,live at the doctor,check for cancer,0
17,3849,3849,3849,3849,Ash painted Jordan's picture for a portrait at the school.,What will Jordan want to do next?,publish the picture,paint over the picture,show his family,0
18,721,721,721,721,Jesse wanted to make some money and decided to shovel snow out of the driveway which Jesse's parents would pay for.,How would Jesse feel afterwards?,cold,relieved to not have to shovel themselves,happy to provide some work,0
19,4353,4353,4353,4353,"After getting a good night's rest, Cameron felt like a normal person and wanted to eat his favorite food, pasta.",How would you describe Cameron?,liked to eat pasta at night,Cameron's favorite food was pasta,satisfied,2
20,1648,1648,1648,1648,Ash knocked the ball out of the park when they hit it yesterday.,How would you describe Ash?,when they hit it yesterday,when they hit it yesterday,a strong person,2
21,1961,1961,1961,1961,Lee tore open the cover. He could hardly wait to see what he had gotten in the mail.,What does Lee need to do before this?,See who it was from,Wait impatiently,Sit down,1
22,2584,2584,2584,2584,"Aubrey sat in the corner, tied to one of the chairs with duct tape. Remy asked Kendall to join Aubrey in the other chair.",What will happen to Kendall?,run from the room before they catch them,get caught by police,be tied to the duct with electrical tape as well,2
23,2635,2635,2635,2635,Jordan found Jan's slick backpack underneath her bed late at night.,What will Jan want to do next?,yell at Jordan for looking through her stuff,again,say thank you,2
24,3025,3025,3025,3025,Quinn decided not to go because he did not want to get into trouble.,How would you describe Quinn?,safe,reckless,cautious,2
25,942,942,942,942,"Jordan eventually started to regret his words, so Jordan told Addison they had said something cruel.",What will happen to Jordan?,want to be more cruel,want to apologize for their words,better getting things off their desk,1
26,612,612,612,612,Cameron's mother had been up late the night before. Cameron took the subway to school.,Why did Cameron do this?,wanted to avoid inconveniencing their mother,get a ticket,find the station,0
27,619,619,619,619,Bailey put on their roller skates while at the skating rink.,Why did Bailey do this?,rollerskate,rest next,skate next,0
28,276,276,276,276,Ash decided to make breakfast and made eggs and bacon.,What will Ash want to do next?,eat a protein-rich meal,clean up,eat an omnivore's meal,0
29,4191,4191,4191,4191,Casey was doing laundry and set Remy's clothing in order for them.,What will Remy want to do next?,move onto the dishes,get their own clothes in order,tell Casey they appreciate it,2
30,2738,2738,2738,2738,Jesse rode a roller coaster at the amusement park with his friends.,What does Jesse need to do before riding?,go to the amusement park,wait for the park to close,spend time with their friends,0
31,2248,2248,2248,2248,Taylor stayed up all night partying and got no sleep. Taylor went to work anyway.,How would Taylor feel afterwards?,awful,pathetic,exhausted,2
32,4990,4990,4990,4990,remy was an idiot so she posted her status on social media.,How would Others feel as a result?,as happy,as angry,doesn't think before speaking,2
33,2769,2769,2769,2769,Tracy defied the governors laws and flew th state flag every morning.,What does Tracy need to do before this?,put the flag inside,learnt he laws of the land,Continue being noncompliant,1
34,2184,2184,2184,2184,Tracy's family is hungry and needs money to eat for the week.,What does Tracy need to do before this?,break into the church,find food,decide to take the money from the bank,2
35,1598,1598,1598,1598,Riley asked Robin to return the books that he borrowed from the library.,What will Riley want to do next?,remind Riley of the due date of the books he borrowed from the library,remind Robin that he has to pay the late fees that he owes at the library,do good,0
36,3400,3400,3400,3400,Alex's gave Jesse a very pleasurable deep tissue full body massage.,What will Alex want to do next?,Get their massage oils,Expect payment without asking,Ask for payment,2
37,4123,4123,4123,4123,Tracy didn't know what was wrong with her grades even tho she studied a lot less than her roommate.,How would you describe Tracy?,a math expert on the rise,lacking in common sense,the teachers pet,1
38,4214,4214,4214,4214,Jordan was going to bake chicken for dinner so Jordan turned the oven on.,What will Jordan want to do next?,turn the oven on for chicken,eat dinner so Jordan turned the oven on,Let the oven pre-heat,2
39,3399,3399,3399,3399,Casey made the choice to go on a hike because he loved the outdoors and loved summertime.,How would you describe Casey?,one who loves summertime,one who loves summer hiking,refreshed,1
40,2346,2346,2346,2346,Sasha threw the candy back. She felt bad about it afterwards when her mother stared at her angrily.,What will Sasha want to do next?,apologize,be healthier,throw more candy,0
41,4390,4390,4390,4390,"Robin jumped carelessly onto the bed, but broke Quinn's glasses on accident.",How would you describe Robin?,thoughtful,clumsy,heart-broken,1
42,3921,3921,3921,3921,Sydney took Robin to the emergency room because Robin cut both of his wrists deeply.,How would Sydney feel afterwards?,helpful,excited to see doctors,anxious and nervous,2
43,4296,4296,4296,4296,Bailey is directing a play and trying to get the best cast.,What will Bailey want to do next?,have good actors,make a decision,have a good play,1
44,4862,4862,4862,4862,"After the intruder stole Jordan's wallet, Jordan ran after him and got his wallet back.",How would Jordan feel afterwards?,he will be upset that he caught up to the intruder,angry,he will be proud that he caught the intruder,2
45,1040,1040,1040,1040,"Even though Kai had lied to Sydney, they still loved Kai nonetheless.",What will happen to Kai?,like telling the truth to Sydney,like ignoring Sydney and their love,confused that Sydney still loves them,0
46,2334,2334,2334,2334,Cameron was having a sleepover and it was time to go to bed. Cameron turned the lights off.,What will Cameron want to do next?,go to bed,watch TV,raise an arm,0
47,4514,4514,4514,4514,Jesse held back the curtain so that she could clean the shower in the guest bathroom.,What does Jesse need to do before this?,purchase cleaning supplies,rinse the bathtub,finish cleaning up the guest bathroom,0
48,4506,4506,4506,4506,"Robin has ridden the bus to work every day, but it's shut down today for some reason.",What does Robin need to do before this?,have a school to go to,have a bus pass,ask a coworker who drives a car if they can pick him up,1
49,4363,4363,4363,4363,Alex opened their own store and started selling goods.,Why did Alex do this?,buy the goods,have his own business,be sick,1
50,3048,3048,3048,3048,Austin invited their boyfriend for dinner and they had a nice steak dinner that night.,What will happen to Others?,spend time with her boyfriend,eat dinner with her boyfriend,full,2
51,1300,1300,1300,1300,Bailey started talking to Sydney after Sydney apologized for being mean.,How would you describe Bailey?,an angry person,a vindictive person,a forgiving person,2
52,2799,2799,2799,2799,Taylor wasn't as bad as Addison thought and they decided became friends.,How would Addison feel as a result?,Like they should talk to their friends,Like they should meet Taylor,Glad to have a new friend,2
53,593,593,593,593,Jan took Kendall to the doctor to get a check up for school.,How would you describe Jan?,As someone who took Kendall to the doctor,better and and ready for school,healthier and thankful to Jan,0
54,570,570,570,570,"Sydney worked hard and did well in the business, getting a promotion soon after starting at a new company.",How would Sydney feel afterwards?,Happy with their quick promotion,a hard worker,Happy for the coworker's promotion,0
55,4463,4463,4463,4463,Robin noticed that Lee did not have a lunch or money for lunch. Robin supplied Lee with food.,Why did Robin give Lee food?,thank Robin for paying,did not have a lunch,owed Lee money,1
56,2918,2918,2918,2918,Sasha just got finished working her two jobs and is now exhausted and home.,What will Sasha want to do next?,be a hard worker,relax at home now,cook,1
57,3374,3374,3374,3374,Cameron gave the class time to finish the final exam for science.,What will the students want to do next?,erase all of their answers,grade the exams,make sure their answers are correct before sumbitting,2
58,4063,4063,4063,4063,"Riley decided to take a stroll, but she could only do this after getting some food and feeding her fish.",What does Riley need to do before taking a stroll?,feed the fish,get some food,eat some fish,0
59,610,610,610,610,Sasha was getting hungry so they ordered pizza.,What does Sasha need to do before this?,satiate the feeling of hunger,have some pizza for supper,call the pizza place,2
60,1160,1160,1160,1160,"Even though Ash told him many times to leave it alone, Ash's parents saw that Lee was riding Ash's bike home from school.",How would you describe Lee?,Someone that doesnt care what others tell him,sorry that he ignored Ash's request,happy that he got away with it,0
61,2315,2315,2315,2315,Jan bought toys for her children to get ready for Christmas.,What does Jan need to do before this?,wrap the presents,put them under the tree,go to the store,2
62,3453,3453,3453,3453,Cameron was getting bullied but decided to fight their own battle.,How would you describe Cameron?,independent,angry,hurt,0
63,1018,1018,1018,1018,Aubrey loved nature. They went hiking in the woods.,What does Aubrey need to do before this?,get bug spray,keep hiking,shower,0
64,4495,4495,4495,4495,Kai walked home from school because he hated taking the bus.,Why did Kai do this?,didn't like the bus driver,keep walking home,had lots of friends on the bus,0
65,2299,2299,2299,2299,"Remy came over to make Tracy feel better after her dog died. After a while, Tracy gave Remy an expression of happiness.",What will Remy want to do next?,anything she can do,get out of the house,thank Remy,0
66,605,605,605,605,Cameron felt the torn muscle in Robin's leg and suggested that they have an MRI to confirm the injury.,How would Robin feel as a result?,upset about the injury,knowledgeable about it,happy about the injury,0
67,2021,2021,2021,2021,"When Remy got a new video game console, she invited friends over to play.",What will happen to Others?,they will decline the invitation,they will be jealous of Remy,they will say  they are too old for games,1
68,1383,1383,1383,1383,Bailey bought a video game from the store to play that night alone.,What will Bailey want to do next?,bored,good,wasn't very good and didn't want to be embarrassed,1
69,3179,3179,3179,3179,Carson found some money and immediately picked it up yesterday.,What does Carson need to do before this?,needed to stay inside,spend the money,needed to go to his car,2
70,3440,3440,3440,3440,Remy let Kendall borrow some toys from her at her last visit. Kendall went to Remy and put toys in Remy's place.,What does Kendall need to do before this?,return the toys she had borrowed,clean the toys for Remy,make sure no one was home,0
71,4201,4201,4201,4201,Someone was teaching Cameron a lesson in manners. Cameron saw what it was like.,How would Cameron feel afterwards?,like they had been talked down to,a student,in etiquette class,1
72,77,77,77,77,"After learning that Cameron was trying to have an affair with their husband, Quinn tried to kill Cameron.",Why did Quinn do this?,punish Cameron for the poor job,go to the police,get back at Cameron for the infidelity,2
73,4820,4820,4820,4820,Remy paid Kendall back right away after borrowing a lot of money.,How would Remy feel afterwards?,dishonest,wasteful,honest,2
74,2464,2464,2464,2464,Sasha left days ago so Bailey was left to practice by himself.,What will Sasha want to do next?,laugh at Bailey,pack for a trip,explain why she left,2
75,2304,2304,2304,2304,Remy loved Tracy a lot and planned a marriage proposal.,What will Remy want to do next?,be the best man next,ask her to marry him next,tell her parents,1
76,778,778,778,778,"Bailey misbehaved and defecated in the house, so Jan inflicted pain on her and sent her to the kennel.",How would Bailey feel as a result?,Loyal and obedient,ashamed with herself,Betrayed and scared,1
77,178,178,178,178,Kai was supposed to go help her club set up for the event but instead she visited some friends' house.,How would Others feel as a result?,grateful,angry,cares more about friends than responsibilities,2
78,3073,3073,3073,3073,Tracy always teased their partner in her biology class.,Why did Tracy do this?,get his attention,continue teasing them,apologize to their biology partner,0
79,3930,3930,3930,3930,"Aubrey came to Lee, distraught as Lee had just lost the game, and hugged them for support.",How would Lee feel afterwards?,resentful,gratified,caring as a result,1
80,1712,1712,1712,1712,Jordan suddenly heard a knock at his door as he was sleeping silently.,How would you describe Jordan?,startled by the knock,jolted wide awake,anxious,0
81,568,568,568,568,if jesse went homeless robin would help jesse.,How would Robin feel afterwards?,indebted to Robin,lucky to know Robin,kind,2
82,4977,4977,4977,4977,Cameron took money from his boss and his paycheck.,What does Cameron need to do before this?,go to work,go to the gym,rob a bank,0
83,1055,1055,1055,1055,Bailey busted the vacuum cleaner by allowing the dust to clog up the filter.,How would you describe Bailey?,careless with her cleaning tools,an appliance maintenance expert,as sad,0
84,2613,2613,2613,2613,Addison put Kendalls ideas into action after cheating off her paper in class.,How would Kendall feel as a result?,rude,Untrusting two people,Nothing at all,1
85,2037,2037,2037,2037,"In their article, Maryland gave the reader a thorough analysis of Riley's perspective.",How would you describe Maryland?,read the perspective,a writer who has interviewed Riley,learn more,1
86,2694,2694,2694,2694,Austin was a big fan of Jan's so he wanted to be like her.,What does Austin need to do before this?,Buy women's clothes,encourage Austin,Cut his hair,2
87,728,728,728,728,"Sydney went to the local shop and after assessing the ones on offer, they bought a replacement microwave.",What does Sydney need to do before this?,purchase a microwave,peruse available microwaves,decide to purchase another one,2
88,2466,2466,2466,2466,Sasha knew she was right despite everyone trying to prove her wrong. She stuck to her guns.,How would Sasha feel afterwards?,dumb,vindicated,strong willed,2
89,385,385,385,385,Jesse took the bus to work for his first time and got to work late and dirty.,How would Jesse feel afterwards?,tired of dealing with people,annoyed with people´s good mood,excited about his first bus drive,0
90,2907,2907,2907,2907,Addison enjoyed their work at the newspaper publisher's company.,How would you describe Addison?,satisfaction from their career,fulfillment from their career,An employee for a newspaper,0
91,4518,4518,4518,4518,"Skylar stood up from the table, where they were eating dinner, and grabbed Cameron's bag.",What does Skylar need to do before this?,look in a bag,Put down her fork and knife,get out of a chair,2
92,2968,2968,2968,2968,Quinn didn't study and needed Alex's help to succeed in the group activity.,Why did Quinn do this?,get back at Alex,was uninformed,Schedule a time to meet Alex,1
93,3462,3462,3462,3462,Carson plays a game on their phone while waiting to be called back for a doctors appointment. Carson beats their own high score.,What does Carson need to do before this?,leave the doctors office,own a cell phone to play on,practice,1
94,3412,3412,3412,3412,Quinn protected the puppy from attack and got the puppy some food later.,What will Others want to do next?,save the puppy from harm,take care of the puppy,strong,1
95,4586,4586,4586,4586,Lee gave Bailey proof of admission into the big movie that night.,Why did Lee do this?,buy a ticket,lazy,secure,0
96,748,748,748,748,Aubrey awaited Cameron's answer about what they wanted to do tonight.,What will Cameron want to do next?,ask cameron what they want to do tonight,give them an answer,study tonight,1
97,1174,1174,1174,1174,Remy didn't want to fall behind and picked up Tracy's pace.,What will happen to Tracy?,get tired of keeping up,slow down for Remy,run away from Remy,1
98,3368,3368,3368,3368,Bailey took the car all day and was able to get a lot done.,How would Bailey feel afterwards?,a hard and productive worker,Good they got things done,Like they should buy the car,1
99,3494,3494,3494,3494,Bailey was a doctor that specialized in left feet. Bailey treated illnesses in patients.,How would you describe Bailey?,a hard worker,grateful,relieved,0
100,4676,4676,4676,4676,Jan bought a coffee for her friend who was very tired.,What does Jan need to do before this?,Ask if they want to talk,take a nap,go to the coffee place,2
101,429,429,429,429,Robin put them to the test to see if they were capable of winning.,How would you describe Robin?,a student,a kid,'s a go-getter,2
102,1283,1283,1283,1283,Casey yelled bingo in front of the whole room who quickly noticed.,Why did Casey do this?,had won the game,play another round,had lost the game,0
103,4618,4618,4618,4618,"Kendall closed the door after Sydney left, but Sydney had forgotten something at Kendall's house.",What will happen to Kendall?,hear a knock,realize they are missing something,come back to get what she forgot,0
104,3752,3752,3752,3752,Alex got a tattoo on a whim because they thought they would look more intimidating.,How would you describe Alex?,same as before,he made a mistake,compulsive,2
105,191,191,191,191,Skylar saved their father's bacon so that it could be served at their family reunion.,What will family members want to do next?,cook the bacon,throw away the bacon,feed the family,0
106,952,952,952,952,Austin built Quinn's house last week as a surprise for Quinn's 50th birthday party.,Why did Austin do this?,do something nice for a friend,give themselves a birthday present,please them,0
107,2777,2777,2777,2777,Lee was staring deep into Jordan's eyes at dinner under the stars on their honeymoon.,How would you describe Lee?,in love with Jordan,happy to be with her love Lee,dating Jordan,0
108,4583,4583,4583,4583,Robin surprised their mother by telling her mother that she is pregnant.,What will happen to Robin?,celebrate with her mom,pregnant,have an abortion,0
109,348,348,348,348,Taylor gave the dog it's food because he had been barking at the bowl on the floor.,What will happen to Others next?,good,kick the dog,watch the dog eat,2
110,3604,3604,3604,3604,Sasha purchased milk cereal from the store knowing she would not have time for a big breakfast in the morning.,Why did Sasha do this?,did this to help a friend who was lactose intolerant,make cookies in the morning,did this to have breakfast in the morning,2
111,3775,3775,3775,3775,Addison plied Casey's trade which was selling mushrooms.,How would Casey feel as a result?,happy to have company,caring,upset about the poaching,0
112,4229,4229,4229,4229,Jan wanted to have pancakes for breakfast on her birthday.,What will she want to do next?,go out for dinner with friends,enjoy her birthday meal,celebrate her special day,1
113,2260,2260,2260,2260,Jordan told Addison he had said something bad when he was in a bad mood.,What will Jordan want to do next?,ask Addison to apologize,better,say sorry,2
114,604,604,604,604,"Ash had a water pipe burst so she hadn't showered for days, she smelled.",How would her coworkers feel as a result?,happy to be around ash,anxious to fix the pipe,like ash had bad hygiene,2
115,3600,3600,3600,3600,Skylar walked Sasha's dog because Sasha was out of town and he didn't want the dog to be sad.,Why did Skylar do this?,hated animals,a cruel person,was an animal lover,2
116,2305,2305,2305,2305,Austin was trying to start a recycling program and Quinn help Austin.,What will Austin want to do next?,thank Quinn for the help they gave,show Quinn their community,talk to Quinn about the help they gave,0
117,4517,4517,4517,4517,Ash assisted his friend in understanding of the very complicated math problems.,How would you describe Ash?,feeling proud,feeling indifferent,tired,0
118,3742,3742,3742,3742,Remy was at a restaurant with their coworkers. They at at a buffet.,How would you describe Remy?,lazy,competitive,fat,2
119,4579,4579,4579,4579,Addison went home. They had nothing to do.,Why did Addison do this?,they were bored,they were excited,find something to do,0
120,4426,4426,4426,4426,Jordan spilled red wine all over the new white carpet at her friend's house.,What does Jordan need to do before this?,admire the brown carpet,apologize profusely for spilling the wine,pour a glass of wine,2
121,2686,2686,2686,2686,Sasha got Alex's wallet back from the library where Alex accidentally left it on the table.,What did Sasha need to do before?,give it back,ask Alex where they left it,sit at the table with Alex,2
122,2501,2501,2501,2501,Tracy obeyed Skylar's order to wash the dishes because they live together.,How would you describe Tracy?,one of Skylar's maids,calm,a good roommate,2
123,1737,1737,1737,1737,sydney prevented the conflict from developing further by settling the situation between their friends.,What will Sydney want to do next?,For their friends to get along,be nice,keep others from entering the conflict,2
124,4920,4920,4920,4920,Aubrey made Kendall's bed because Kendall was in a rush to go to the airport.,What does Aubrey need to do before this?,clear the bed,be friendly,be helpful,0
125,3212,3212,3212,3212,"Tracy was unwilling to attend a friend's party but her sister, Sydney, persuaded her to go.",What will Sydney want to do next?,know who the friend is,humor her sister,attend the party,2
126,2045,2045,2045,2045,Sasha caught the flu and slept a lot. They got really sick.,How would Sasha feel afterwards?,better,unchanged,feeling ill,2
127,1297,1297,1297,1297,Remy had examined Bailey's body and eventually revealed the cause of their death.,What will Bailey want to do next?,inform family,call the family,type a report,0
128,4058,4058,4058,4058,Casey was trying to put a stubborn shelf together.,Why did Casey do this?,ask one of her friends for help,look at the directions again,get paid,2
