,Unnamed: 0,Unnamed: 0.1,Unnamed: 0.1.1,Unnamed: 0.1.1.1,sent1,sent2,ending0,ending1,ending2,label
2354,2098,2098,2098,2098,Casey always admires their favorite author.  Casey met the author in person.,How would Others feel as a result?,glad that Casey had bought their book,a fan of reading,o busy to see their admirer,0
2355,2714,2714,2714,2714,Alex kept bringing Addison along to all of her prenatal appointments so that Addison would feel included as her sister.,How would you describe Alex?,uncaring of how Addison feels,considerate of others,concerned with her privacy,1
2356,4926,4926,4926,4926,"After finally buying the new SUV that they had been dreaming of, Sasha showed Kai's daughter their car.",What will happen to Sasha?,want a ride,get jealous,get to know the features of their new SUV,2
2357,2386,2386,2386,2386,Austin pulled Taylor closer in a hig after Taylor's father died.,Why did Austin do this?,wanted to support Taylor,talk,sorry for his loss,0
2358,305,305,305,305,"Quinn was sleeping on their stomach, so Kendall kissed Quinn's neck.",How would Quinn feel as a result?,Smitten,Ignored,loved,2
2359,3327,3327,3327,3327,Skylar asked her friends to come over and help.,What will Others want to do next?,loved,joy,ask why she needs help,2
2360,4059,4059,4059,4059,Jordan called out Austin's name to assist him getting out of bed.,What will happen to Austin?,mute the speaker,ignore Jordan,help Jordan out,2
2361,2347,2347,2347,2347,remy was a big person so she got jesse's phone back from the bully.,How would Jesse feel as a result?,as unappreciative,as appreciative,as ungrateful,1
2362,3928,3928,3928,3928,Jesse had several wild hogs bothering his cattle. Jesse went pig hunting.,Why did Jesse do this?,stop the livestock from eating the pigs,protect their animals,keep the pigs for his cattle,1
2363,1524,1524,1524,1524,"After she was done with work, Aubrey walked to her home.",Why did Aubrey do this?,make dinner,complete a race,Get some excercise,2
2364,562,562,562,562,Skylar's sibling Kai had a cold. Skylar cooked for Kai while they convalesced.,Why did Skylar do this?,thank skylar,wanted to help Kai,eat some food,1
2365,2680,2680,2680,2680,Remy had studied very hard and knew everything on the test.,What will Remy want to do next?,drop the class,retake the test,get a good grade,2
2366,45,45,45,45,Tracy was teaching Kendall to dance so Tracy raised Kendall's hips into the right position for the next move.,How would you describe Tracy?,a bad teacher,hopeful that this doesn't make Kendall uncomfortable,a patient teacher,1
2367,934,934,934,934,Austin came back to Carson after the breakup.,What does Austin need to do before this?,remain the same,change his ways,date somebody else,1
2368,3169,3169,3169,3169,Aubrey gave me water to pass out to the cyclists riding in the race.,What will the cyclists want to do next?,grab a sandwich after they cross the line,wanted to be a part of the race,drink the water and get rehydrated,2
2369,1,1,1,1,Jan needed to give out jobs for an upcoming project at work.,What will Others want to do next?,disagree with Jan,get to work,argue with the assignments,1
2370,2567,2567,2567,2567,remy looked into the time machine and realized he would receive a reward in the future.,How would you describe Remy?,Remy should look at their future also,as curious,as stupid,1
2371,1359,1359,1359,1359,Riley had a shower then Riley turned the water off and stepped out.,How would Riley feel afterwards?,weary,clean,a normal person,1
2372,3260,3260,3260,3260,Jan got her first haircut at the mall on the weekend.,Why did Jan do this?,get hair cut,look bad,have long hair,0
2373,2178,2178,2178,2178,Skylar gently grabbed Kendall's head and slowly tilted it back towards them.,What does Skylar need to do before this?,Tilt their head back,apologize to kendall,Gain Kendalls permission,2
2374,380,380,380,380,Jordan volunteered to stand by the grocery store and register voters on a tablet.,How would you describe Jordan?,Like a voter,angry with politicians,involved in politics,2
2375,30,30,30,30,Addison bid Carson goodbye before the ship left the dock.,What will Addison want to do next?,wave goodbye,jump off the boat,yell to Addison,0
2376,4901,4901,4901,4901,Robin knew that Alex had a lot going on and was too shy to mention it.,Why did Robin do this?,show Alex how to be a coward,ask Alex about it,help Alex,2
2377,3267,3267,3267,3267,Carson took Jordan's hand in their hand and together they jumped off the cliff and into the water.,How would you describe Carson?,an adventurous friend,a withdrawn friend,a caretaker,0
2378,4689,4689,4689,4689,"After a long day at work, Casey finally  bought food in the store. She has been procrastinating it since last week.",What does Casey need to do before this?,decide to go to the store,lay in bed,ran out of food at home,0
2379,3057,3057,3057,3057,Lee turned Taylor's thoughts into something good but she was still struggling with bad thoughts.,What will Taylor want to do next?,stay focused on good things,she wanted to be happy,forget what Lee said,0
2380,475,475,475,475,Skylar followed her everywhere and they were always in love with eachother.,Why did Skylar do this?,lazy,fall in love,in awe,1
2381,2355,2355,2355,2355,Addison learned to walk and had a good time making the first jog.,Why did Addison do this?,needed to stretch,bored,skilled,2
2382,2766,2766,2766,2766,Addison dedicated Tracy's academic journal to the library on that day.,What will happen to Tracy?,no one will like her,her book will be disrespected,she will be read,2
2383,390,390,390,390,Carson invited Taylor to their house as their date was finishing up.,How would you describe Carson?,drunk,quite interested,nervous,1
2384,4006,4006,4006,4006,Casey and Jan performed their duty of going to the lands and fighting for their country.,What will Casey want to do next?,proud,lazy,get home and relax,2
2385,700,700,700,700,Quinn was making better money than they ever made before. Quinn had a new job that they loved.,Why did Quinn do it?,be accepted as an employee,search for the job,be somewhere else,0
2386,1958,1958,1958,1958,"Austin was angry at Aubrey for speaking bad about him, so he popped her in the head.",Why did Austin do this to Aubrey?,let Aubrey know he was upset,be in love with Aubrey,be happy,0
2387,1221,1221,1221,1221,Robin became very interested in the subject and wanted to learn more.,How would Robin feel afterwards?,smart,intellectual,curious,2
2388,2899,2899,2899,2899,Kendall made Quinn use a fork with his pizza because it was the fancy thing to do.,How would Quinn feel as a result?,lazy,loved,bored,1
2389,4445,4445,4445,4445,Kai went with Casey to see a new movie that was playing.,What will Kai want to do next?,watch the movie,Get popcorn and soda,go to a horse race,0
2390,4952,4952,4952,4952,Austin made a lot of money when he went to the gold mine.,How would Austin feel afterwards?,destitute,rich,poor,1
2391,1626,1626,1626,1626,"Kendall wanted a challenge, so Kendall entered a marathon.",What does Kendall need to do before this?,eat healthy,watch movies,push themselves,2
2392,3114,3114,3114,3114,Jordan ate healthy food by cooking from scratch and meal planning.,How would you describe Jordan?,on a diet,good about the choices they made,careless with his health,1
2393,3182,3182,3182,3182,Bailey made Taylor inventory count because they needed to.,What does Bailey need to do before this?,go away,teach Taylor responsibility,count the inventory,2
2394,2351,2351,2351,2351,Luna was applying to nursing school and asked Lee for a recommendation letter.,What did Luna need to do before this?,offer a letter as well,apply to nursing school too,finish the nursing prerequisites,2
2395,2307,2307,2307,2307,Sasha made decisions for Remy because she was so young.,What does Sasha need to do before this?,confirm how Remy feels,research ideas,Be a bad mother,1
2396,134,134,134,134,lee was wealthy and felt guilty so he gave a lot of money to charity.,How would Others feel as a result?,as ungrateful,as appreciative,as unappreciative,1
2397,4679,4679,4679,4679,Taylor opened the door for their friend Ash and they walked in.,What does Taylor need to do before this?,walk to a door,lay down,drive a bus,0
2398,2908,2908,2908,2908,Jan's dog had been lethargic all week. Jan took her dog to the veterinarian.,Why did Jan do this?,visit the vet for more shots,get medicine,make sure their dog was okay,2
2399,611,611,611,611,Sasha raised a hand while she was in english class.,Why did Sasha do this?,answer incorrectly,give the answer,query the teacher,1
2400,520,520,520,520,"In order to understand why Skylar was so bitter about life, Kendall decided to walk a mile in their shoes.",How would you describe Kendall?,Unwilling,Empathetic,Misunderstood,1
2401,2118,2118,2118,2118,Lee finally found it.,Why did Lee do this?,lee not fount,finally found it,lee found a gold coin,1
2402,1474,1474,1474,1474,Jan lived happily every after after she find the job of her dreams.,How would you describe Jan?,walking through a dream,living a fairy tale,living her dream,2
2403,768,768,768,768,Jordan set Carson free after many years in captivity.,Why did Jordan do this?,look for more prisoners,help Carson,do the wrong thing,1
2404,2913,2913,2913,2913,"Taylor lost their engagement ring in the hope, she desperately hoped she would find it and after two long hours searching, it was found in her jean pocket.",How would Taylor feel afterwards?,careless with her ring,does not keep track of her ring,Relieved,2
2405,4549,4549,4549,4549,Austin took some drinks with their friends and got very drunk at the bar.,What will Others want to do next?,try to solve a math equation,behave in a drunken manner,try to sew a sweater,1
2406,1163,1163,1163,1163,Sasha took her dog out for a walk every morning before work. It was their ritual.,What will Sasha want to do next?,walk the dog,refuse to walk the dog,hurt the dog,0
2407,430,430,430,430,addison had nothing else to do for the weekend so he watched the film.,Why did Addison do this?,alleviate boredom,eat,go out,0
2408,4188,4188,4188,4188,Cameron was a quarterback of their football team.  They gathered everyone together.,How would you describe Cameron?,ready to follow Cameron,a football player who likes to tell others what to do,a football player who has a leadership skill,2
2409,2573,2573,2573,2573,Carson learned to read before his fourth birthday and spent many hours with his books.,How would you describe Carson?,entertained with the book,a lazy child,an inquisitive child,2
2410,571,571,571,571,Alex promised Addison a new cat for their birthday.,What will Addison want to do next?,get a cat,go to the movies,get a turtle,0
2411,4776,4776,4776,4776,Jan started a blog. she needed to improve the business she was in.,Why did Jan do this?,out of spite,work on her business,try something new,1
2412,1437,1437,1437,1437,"Tracy had fallen on hard times and asked Jordan for money, so Jordan told Tracy to get a job.",How would Jordan feel afterwards?,justified for telling Tracy to get a job,angry,rejected,0
2413,109,109,109,109,Ash walked to her friend's house and gave her a brand new cake.,What does Ash need to do before this?,play poker,play baseball,bake a cake,2
2414,3536,3536,3536,3536,Bailey assumed Casey's position and thought it was a great idea on how to fix the environment.,How would Casey feel as a result?,calm,smart,passive,1
2415,2463,2463,2463,2463,Cameron watched a movie on Remy's phone and read Remy's texts.,What will happen to Cameron?,watch another movie,get caught,have nothing happen to her,1
2416,814,814,814,814,"Riley thanked you for Bailey's letter, which came as a surprise to me.",How would you describe Riley?,correct,kind,violent,1
2417,1051,1051,1051,1051,Jan drove back home from the place they'd visited because they had to work in the morning.,Why did Jan do this?,get some sleep,get some drinks,have to work,0
2418,2909,2909,2909,2909,Kendall kicked the goal that won the game for her team.,What will Kendall want to do next?,play hard,retire from sports,high five their teammates,2
2419,1566,1566,1566,1566,Cameron felt tension run down Robin's leg as he prodded the bruised ankle to check for further signs of damage.,How would Robin feel as a result?,like calling for help,hopeful Cameron knows what they are doing,like blaming the referee,1
2420,3140,3140,3140,3140,Carson got rid of the mess from the party in his girlfriend's apartment.,Why did Carson do this?,make sure his girlfriend wasn't stressed about it,take a nap,hug his girlfriend,0
2421,513,513,513,513,Ash played basketball with his friend every week for a year.,Why did Ash do this?,be lazy with his friend,share his knowledge of the sport,find friends who want to play basketball with them,1
2422,2700,2700,2700,2700,Cameron performed at a comedy show and was really funny.,What will happen to Cameron?,have another show,receive good reviews,be criticized,1
2423,3989,3989,3989,3989,Casey told Bailey to help him with the math test he needed to take.,How would Bailey feel as a result?,very mean,very into math,very rude,1
2424,38,38,38,38,Carson made lots of friends when they went to the club last night.,What will Carson want to do next?,spend time with others,not talk to anyone,avoid others,0
2425,1458,1458,1458,1458,Jesse ran Alex's fingers across the keys.,How would you describe Jesse?,jessie ran away,ran Alex's fingers across the keys,jessie goes in bike,1
2426,2796,2796,2796,2796,Riley expressed Kendall's feelings to the panel when Kendall was too distraught to talk.,What will happen to Riley?,be ignored by the panel,be thrown out of the room,be given a message for Kendall,2
2427,2186,2186,2186,2186,Alex invited Sasha's friends over for a yummy dinner of a big ham with some rolls.,How would you describe Alex?,feeling bored,feeling loved,isolated,1
2428,1292,1292,1292,1292,Ash went through the house trying to make it safe. Ash reduced their risk of a fire occurring.,What will Ash want to do next?,protect themselves,have a house,enter their home,0
2429,2281,2281,2281,2281,Sydney bought a replacement tire when her tire failed on the road.,What will Sydney want to do next?,put it on,do nothing,ignore the bad tire,0
2430,3819,3819,3819,3819,Robin devoted himself to writing after being encouraged by a prominent English professor.,How would you describe Robin?,an older writer,an aspiring writer,a famous typist,1
2431,1945,1945,1945,1945,Aubrey told Riley her favorite band.,How would Riley feel as a result?,hungry,angry,interested,2
2432,4741,4741,4741,4741,Taylor payed Kendall a visit at work to find out the states in the new development.,What will Kendall want to do next?,get out of bed,give excuses about the delay,go to work,1
2433,1639,1639,1639,1639,"Seeing that the dog was getting rambunctious, Jan let him outside.",How would Jan feel afterwards?,resentful of their dog,bitterness towards their dog,entertained by the dog,2
2434,4998,4998,4998,4998,Jesse went potty in the portable toilet.,Why did Jesse do this?,leave the toilet,he didn't have to go,his bladder was full,2
2435,1228,1228,1228,1228,Kai spent all day raking leaves and putting them into bags.,How would you describe Kai?,a lazy person,a good worker,tired,1
2436,1039,1039,1039,1039,Kai knew that Remy looked up to her.  She wanted to keep him safe.,What will Kai want to do next?,hurt Remy,lie to Remy and hurt his feelings,safe,2
2437,1193,1193,1193,1193,Skylar learned german in high school and began planning a trip to Germany.,What will Skylar want to do next?,plan a trip to Spain,shop for flights,cancel a flight,1
2438,2228,2228,2228,2228,Alex kept Casey occupied while her friends set up the birthday party.,Why did Alex do this?,surprise Casey,stay occupied,annoy Casey,0
2439,1919,1919,1919,1919,Casey greeted their parents later.,Why did Casey do this?,greet the family dog,wanted to be kind,was being awkward,1
2440,4120,4120,4120,4120,Taylor politely asked for the book at the library when it came in.,What will Others want to do next?,withhold the book,help Taylor out,wanted to read the book,1
2441,2807,2807,2807,2807,"After making it over the course of several hours, Riley began eating their meal.",Why did Riley do this?,take a drink,clean up her meal,wanted to enjoy the fruit of their labor,2
2442,168,168,168,168,Casey was planning Aubrey's wedding and was performing her duties exactly as requested.,How would you describe Casey?,proud,unreliable,obedient,2
2443,527,527,527,527,Quinn walked to the grocery store even though is was raining cats and dogs.,What does Quinn need to do before this?,eat a cheeseburger,wear a paper hat,get an umbrella,2
2444,740,740,740,740,Carson pulled the car away and got it into a car shop for repairs.,Why did Carson do this?,lazy,strong,faulty,2
2445,2695,2695,2695,2695,Carson accidentally chipped Quinn's tooth in the operating room.,What will Carson want to do next?,fix it,yell at her,break it more,0
2446,3171,3171,3171,3171,Jesse put Lee's worries at ease with a combination of logic and compassion.,What will happen to Lee?,be further duped by Jesse,relaxed,resentful,1
2447,4499,4499,4499,4499,Robin looked after their interests when they were unable to do so for themselves.,Why did Robin do this?,did this to sabotage,did this to be selfish,did this to be kind,2
2448,4024,4024,4024,4024,Cameron felt cuts in Robin's leg after the glass shattered in the car accident.,Why did Cameron do this?,Check to see if they should call an ambulance,See if Robin wanted to dance,dial 911 and stay with Robin,0
2449,116,116,116,116,Austin moved to California to pursue their career in acting.,How would you describe Austin?,excited to follow his dreams,nervous to be away from home,determined,2
2450,4786,4786,4786,4786,"Quinn made Alex straighten up and did better, thereby turing him around.",How would you describe Quinn?,a little intimidated,a caring person,embarrased for sitting wrong,1
2451,2629,2629,2629,2629,Jesse was cold so he layered more and more blankets on the bed.,How would you describe Jesse?,trying to warm up,hot and burning,like a cow,0
2452,4480,4480,4480,4480,Kendall bought a new mattress for her room because her old one was torn up.,Why did Kendall do this?,wanted to wake up early,have the mattress delivered,sell the old mattress,1
2453,2468,2468,2468,2468,Jan took a sip of Sydney's coffee to try the taste.,How would you describe Jan?,friends with Sydney,spreading germs,stealing Sydney's coffee,0
2454,4808,4808,4808,4808,jesse was a reasonable person so he made sure to thank bailey's friends for the support.,What will Bailey want to do next?,thank jesse,praise Bailey's friends,do something for Bailey's friends,0
2455,4592,4592,4592,4592,Cameron ended their career at 40 and moved to Florida to enjoy warm climate.,What did Cameron need to do before this?,was tired of dealing with the winter,had to save lots of money,had to commute to Florida,1
2456,3488,3488,3488,3488,Jesse visited their parents for an entire week for Christmas that year.,What will happen to Jesse?,get gifts,be reprimanded,get grounded,0
2457,14,14,14,14,Remy blinked Quinn's eyes because Quinn was paralyzed after the car accident.,What does Remy need to do before this?,Cry,move Quinn's eyelids,Lay still,1
2458,2593,2593,2593,2593,Jesse plays professional poker. Jesse played cards all day at the tournament and made it to the final round.,How would Jesse feel afterwards?,a poker player,in a tournament,jittery & excited,2
2459,4537,4537,4537,4537,Alex was known as a good student who enjoyed going to school.,What will Alex want to do next?,flunk out,ditch class,graduate,2
2460,4264,4264,4264,4264,Bailey had gone to business school so they helped Ash start their own business.,How would Bailey feel afterwards?,That she could have done more,That she was a good friend,That she had been selfish,1
2461,4966,4966,4966,4966,Addison was so tired she had a great night sleep that night.,What will Addison want to do next?,go for a run,Keep sleeping,because Addison felt like winding down after a long day,1
2462,4380,4380,4380,4380,Bailey got cancer and sadly died shortly after giving birth so as promisee Lee took Bailey's baby and raised it as their own.,What will Lee want to do?,look after the child until they grow up,neglect the child until they grow up,make sure the child know nothing about their biological mum,0
2463,4757,4757,4757,4757,Quinn knew were were missing our firends and parents and Quinn surprised us with a party and she invited all of our friends.,How would you describe Quinn?,indifferent,someone who cares for other,wanted,1
2464,140,140,140,140,according to the article Taylor got a closer look.,How would you describe Taylor?,clear person,helpful in work,happy person,1
2465,216,216,216,216,Sasha sang at work when it came to a guests' birthday.,Why did Sasha do this?,wanted to pester the guest,wanted to earn money singing,belonged,1
2466,3416,3416,3416,3416,Kendall hurt their back while they were packing up all of their stuff to move into a new apartment.,Why did Kendall do this?,better,call the movers,save money by doing it theirself,2
2467,56,56,56,56,Austin fought for Quinn and she was very happy to know him.,How would Austin feel afterwards?,vored,lame,caring,2
2468,776,776,776,776,Cameron played games outside. They loved to play outdoors.,How would you describe Cameron?,someone who hates nature,someone who loves nature,they were satified,1
2469,2615,2615,2615,2615,Kendall thanked Sasha for Lee's help in an email in his office at school.,Why did Kendall do this?,protest something,be polite,show his anger,1
2470,3141,3141,3141,3141,Remy was in a hurry to give directions so Remy cut to the chase.,What will Remy want to do next?,needed to make sure the directions were accurate,give directions in an organized fashion,needed to clear their throat,1
2471,1520,1520,1520,1520,Lee was making tacos for lunch and put some cream in the bowl.,Why did Lee do this?,get a spoon,wanted to satisfy himself,get sour cream,1
2472,3623,3623,3623,3623,Cameron brought their family to his play.  Their family enjoyed the play.,What will Cameron want to do next?,congratulate Cameron,thank their family for coming,take them to a restaurant but none was open,1
2473,4647,4647,4647,4647,Bailey took a train to visit family and had a big lunch for that day.,Why did Bailey do this?,purchase train tickets,proud,passive,0
2474,4870,4870,4870,4870,Sydney used their sewing machine to make a quilt for the homeless children she met.,What does Sydney need to do before this?,stop sewing,buy fabric,break her machine,1
2475,1247,1247,1247,1247,"Taylor became best friends with them, and they stayed in touch all their lives.",What will Taylor want to do next?,get to know their weaknesses,get to know their families,invite them over for punishment,1
2476,4186,4186,4186,4186,Aubrey got the keys and went outside to start Remy's truck.,What will Aubrey want to do next?,go to sleep,turn down the radio,got in the truck,2
2477,4299,4299,4299,4299,Quinn was surprised with a birthday cake. Quinn burnt the candle at both ends. She had an amazing night.,How would Quinn feel afterwards?,happy,uncomfortable,bored,0
2478,1621,1621,1621,1621,Tracy waited in the bushes and saw Alex's friends come around the corner.,What will Alex want to do next?,call out to Tracy,continue walking to the movie theater,surprise them,0
2479,66,66,66,66,Taylor used a chart to help explaining the complex logic and design of the system to the teammates.,What will Others want to do next?,ask questions,take revenge,taylor who has explining the system teamates,0
2480,2002,2002,2002,2002,Skylar produced the weapon in response and thought it would be best to call for backup.,What will Skylar want to do next?,ignore the radio,call for backup,Others will be happy to have the weapon,1
2481,2477,2477,2477,2477,Addison got a haircut with Casey and they both loved their new hairstyles.,Why did Addison do this?,go to a library,get rid of split ends,go home,1
2482,3788,3788,3788,3788,Casey followed the dog far before finally catching him and bringing him home.,How would you describe Casey?,home,committed,tired from chasing the dog,1
2483,1167,1167,1167,1167,Addison put the cookies away after she finished cooking them.,Why did Addison do this?,give the cookies to friends,clean up,throw them away,1
2484,2434,2434,2434,2434,Sydney told Carson that they liked how they played during the game.,How would you describe Sydney?,caring,proud of herself,hateful,0
2485,2837,2837,2837,2837,Tracy was at the grocery store with Lee's mom to get some cupcakes and bread.,What will Tracy want to do next?,leave abruptly,find more groceries,forget her purse,1
2486,4886,4886,4886,4886,after several failed attempts lee was finally expecting a baby.,How would their family feel as a result?,mad and upset,angry and sad,blessed and optimistic,2
2487,1533,1533,1533,1533,Quinn took their sister for ice cream to celebrate her birthday.,What will Quinn want to do next?,yell at their sister,good,order the ice cream,2
2488,1719,1719,1719,1719,Lee called everyone to go to the big party this coming Friday.,How would Others feel as a result?,hushed,bored,happy,2
2489,936,936,936,936,Taylor told their good friend that they loved them a lot.,How would Others feel as a result?,in love,tired,depressed,0
2490,717,717,717,717,Sasha looked at their friend Casey and told them that all would be well.,What will Sasha want to do next?,sit down,be rude,be nice to their friend,2
2491,3429,3429,3429,3429,carson was a nice person so he had no problem sharing his gifts with others.,What will Others want to do next?,resent carson,appreciate carson,hate carson,1
2492,910,910,910,910,Alex governed every person as if he was the one in charge.,How would Alex feel afterwards?,very weak,a bossy person,very powerful,2
2493,933,933,933,933,Ash wanted anyone to know about the upcoming birthday party at the bar.,How would Ash feel afterwards?,bored,passive,joyous,2
