,Unnamed: 0,Unnamed: 0.1,Unnamed: 0.1.1,Unnamed: 0.1.1.1,sent1,sent2,ending0,ending1,ending2,label
1166,3466,3466,3466,3466,"The rain was coming down hard and the road was flooding. Also, they had been drinking for hours. So, Riley stayed at Ash's place.",Why did Riley do this?,Find a pillow or couch,avoid driving while drunk and taking risks,Put sheets on the couch,1
1167,3717,3717,3717,3717,Lee gave some food to the homeless people.  They also gave some money to them.,What will Others want to do next?,leave without saying goodbye,thank Lee,make some food for the homeless,1
1168,2125,2125,2125,2125,Jesse fell off the skateboard and scraped his knee on the pavement.,How would Jesse feel afterwards?,in pain,daring,pleasure,0
1169,2216,2216,2216,2216,Jan went to a new school and joined the basketball team to show their skills.,How would Others feel as a result?,unhappy to have Jan on the team,like quitting the team,jealous of the talent,2
1170,868,868,868,868,Quinn also turned around when he saw the crowd changing direction to avoid an accident.,Why did Quinn do this?,Walk away from the crowd to stay safe,did this to get out of the way,did this to go against the grain,1
1171,3421,3421,3421,3421,Remy finally was able to get a new bed and left their old bed on the curb.,Why did Remy do this?,get a new bed,have the garbage truck pick it up,throw out the old bed,1
1172,4406,4406,4406,4406,Lee was tired of debating so he ended it.,What will Others want to do next?,Stop debating,Go home and forget about the debate,Be annoying,0
1173,3651,3651,3651,3651,Kai let the dog in when it started snowing and the temperature dropped.,Why did Kai do this?,have a door,be kind,keep the dog warm,2
1174,3126,3126,3126,3126,"After searching all over the place, Skylar finally found their purpose in the world when they discovered boating.",Why did Skylar do this?,have a porpoise in their life,figure out they needed to find a purpose in life,have purpose in their life,2
1175,43,43,43,43,"Aubrey was working the door at a concert, so Aubrey asked the girl coming in for money.",What will Aubrey want to do next?,old enough to drink,ask the girl to leave,needed to get to work,1
1176,2286,2286,2286,2286,kai married a girl he met in the city when he went there for vacation.,What will Others want to do next?,refuse to support kai,meet a girl,encourage kai,2
1177,4671,4671,4671,4671,"Seeing that Ash was feeling left out, Carson told Ash their story.",What will Carson want to do next?,hear about Ash,tell jokes,be thankful,0
1178,4666,4666,4666,4666,Jesse saw a person burning alive and it was very traumatic.,How would Jesse feel afterwards?,happy,scared,glad,1
1179,774,774,774,774,Carson surprised Kendall with a party after Kendall told him he hated surprises.,How would Carson feel afterwards?,amused at Kendall's reaction,angry at Kendall,embarrassed for not listening,2
1180,1446,1446,1446,1446,Skylar went to the arena and played a game of soccer with some friends that were there.,What will happen to Others?,go to a barber,take a bath,have fun,2
1181,4162,4162,4162,4162,Bailey baked cookies for Alex because Bailey wanted to make Alex feel better.,How would you describe Bailey?,someone who likes sweets,a kindhearted person,an avid baker,1
1182,4983,4983,4983,4983,Skylar got a wiggle on and realized people were watching her.,How would Skylar feel afterwards?,proud,embarrassed,quite oblivious,1
1183,2327,2327,2327,2327,Every afternoon Jordan took a quick nap to rejuvinate himself.,How would you describe Jordan?,althy,Annoyed,Agitated,0
1184,2980,2980,2980,2980,Robin wrote a story on the trial and posted it to their blog page and got a death threat.,What will Robin want to do next?,move out of state,Be anonymous,leave their doors unlocked,1
1185,859,859,859,859,"Jan played video games 10 hours in day, video games became really addictive and he lost his job.",What will Others want to do next?,take the video games away,Others will be happy and buy more games for Jan,Others will be exited because its a healthy addiction,0
1186,1488,1488,1488,1488,Sasha was going to bake pizza for dinner tonight. She took the pizza out of the freezer.,What does Sasha need to do before this?,put pepperoni on the pizza,needed to decide on chicken,needed to decide on pizza,2
1187,3144,3144,3144,3144,Addison really enjoyed spending a lot of time with Aubrey.,Why did Addison do this?,be Aubrey's best friend,give Aubrey a kiss,yell at Aubrey,0
1188,3720,3720,3720,3720,Riley screamed out loud with her friend to cheer on the team.,How would you describe Riley?,As someone who could be supportive,As someone who roots on their team,excited,0
1189,1613,1613,1613,1613,Remy covered alex's body with a cover because it was starting to hail and alex might get hurt.,What will happen to Remy?,be angry,be relieved,stay safe during the storm,1
1190,2989,2989,2989,2989,Sydney replied back with an updated ETA on when the project would be finished.,How would Sydney feel afterwards?,like to finish products,proud,nervous,1
1191,1820,1820,1820,1820,"Hundreds of customers had lined up for the store´s big promotion, and to maintain order then were given numbered tickets, so when the customer approached the service desk, Carson gave the customer a ticket.",Why did Carson do this?,did this to punish the customer,did this to organize the line of customers,did this to teach the customer a lesson,1
1192,1842,1842,1842,1842,Skylar found a friend named Joe and became best friends with them.,How would you describe Skylar?,nice,like tehy have a friend,lonely,1
1193,4422,4422,4422,4422,Aubrey just got a new job but did not know any of their coworkers.,What will Aubrey want to do next?,ignore their coworkers,needed to pay student loans,talk to their coworkers,2
1194,3299,3299,3299,3299,Quinn maintained Riley's balance as Riley was about to fall over while walking.,What does Quinn need to do before this?,leave Riley alone,help out Riley,let Riley get hurt,1
1195,4588,4588,4588,4588,Kai pulled their money together to buy Mortal Kombat 11 for PS4.,What will Kai want to do next?,Not pre order so they have an incomplete roster,Wait for Mortal Kombat 11 to come out,wait and buy it on release day,2
1196,1695,1695,1695,1695,Sasha put forth effort in making a good cake for the birthday party.,How would you describe Sasha?,like a skilled baker,feeling skilled,feeling lazy,0
1197,2564,2564,2564,2564,Aubrey was playing football with their friends and fell on her feet while playing.,What will happen to Aubrey?,bad for Aubrey,pain,have fun,1
1198,3995,3995,3995,3995,Carson got a new game for their birthday. They learned how to play the game.,How would you describe Carson?,silly,excited,smart,1
1199,409,409,409,409,Addison took advantage of the people closest to her in order to succeed.,What will Addison want to do next?,be the most succesful,fail,do badly,0
1200,722,722,722,722,"Kendall went on a field trip with their class, and they father Remy came along.",What does Remy need to do before this?,find out about the field trip,get home from the field trip,she had fun,0
1201,3636,3636,3636,3636,Remy bought a ticket to a concert after days of thinking about spending the money or not.,How would you describe Remy?,someone who cares about money,enjoy concerts,like he made the right choice,0
1202,2949,2949,2949,2949,Jan wanted eggs for breakfast but didn't have any in the fridge.,What does Jan need to do before this?,go to the store,buy some eggs,make an omelette,1
1203,4975,4975,4975,4975,Sydney read Austin the riot act after he left the door open all night.,Why did Sydney do this?,did this because she was happy,did this because she was frustrated,Take things away from Austin,1
1204,4589,4589,4589,4589,Aubrey bought a gift card and gave it away as a gift for someone else.,How would Others feel as a result?,appreciative of aubrey,sad about the gift card,angry at aubrey,0
1205,3118,3118,3118,3118,Tracy was resiliant and overcame every odd that came at them.,How would Tracy feel afterwards?,accomplished,defeated,like they are unable to deal with things,0
1206,3367,3367,3367,3367,Jesse was riding their motorcycle and wrecked going thru a mud puddle at 60 mph.,What does Jesse need to do before this?,drink a good amount of alcohol before driving,look to the left at the field's produce crop,swerve out of the way of the mud puddle,2
1207,1829,1829,1829,1829,Sydney really liked Skylar and was trying very hard to become Skylar's girlfriend.,What will Sydney want to do next?,send flowers to Skylar,flirt with the clerk at the ice cream parlor,insult Skylar,0
1208,1891,1891,1891,1891,Quinn avoided Tracy's advances since he was a married man.,How would Tracy feel as a result?,capable,rejected,confident,1
1209,874,874,874,874,Kai joined Bailey for their grandmother's surprise birthday dinner at restaurant far away.,How would you describe Kai?,supportive of military,loves their family,loves their house,1
1210,2128,2128,2128,2128,Sasha asked Lee's mom to help even though Lee asked them not to.,How would Lee feel as a result?,betrayed,happy,sneaky,0
1211,1793,1793,1793,1793,Jordan bound Robin's hands together and threw her roughly into the back of their truck.,What will Robin want to do next?,take Robin to a secluded area,take Robin to the lake,try and scream for help,2
1212,2353,2353,2353,2353,Taylor brought Riley to the school and he brought her into the cafeteria for the dance.,What will Taylor want to do next?,dance with Riley,he brought her into the cafeteria,rent a movie,0
1213,2282,2282,2282,2282,ash was annoying so she moved cameron's shoe by an inch to see his response.,What will Cameron want to do next?,tell ash to stop,ignore ash,laugh at ash,0
1214,3153,3153,3153,3153,Having had a few drinks after dinner Robin was feeling her oats.,How would you describe Robin?,up for adventure,scared of her shadow,ready for bedtime,0
1215,1911,1911,1911,1911,Jordan produced some honey annually to give away to friends and family.,What will Others want to do next?,listed the people he was giving honey to,appreciate jordan,bought containers to store the honey,1
1216,4785,4785,4785,4785,"Casey was new at the school, she really wanted to fit in so he joined a club.",What will Others want to do next?,ask her to go back to where he came from,tell her to be the coach,ASK Casey where she was,2
1217,2810,2810,2810,2810,Bailey needed a lawyer after she was cheated. Taylor became Bailey's advocate.,Why did Taylor do this?,learn about Bailey,get presteige,get experience,2
1218,4604,4604,4604,4604,Kai shot a deer and was upset when he saw it suffering.,How would Kai feel afterwards?,satisfied afterwards,happy afterwards,regretful afterwards,2
1219,3789,3789,3789,3789,There are many generations of family here and Sasha was succeeded by her son.,Why did Sasha do this?,ask questions about her family,not have more kids,know more about her family tree,2
1220,1219,1219,1219,1219,Carson gave a book to his son after buying it off his good friend.,What will happen to Others?,'ll get paid for it,'ll get nothing,be a good father,0
1221,4200,4200,4200,4200,Taylor impressed upon you the standards that needed to be upheld in his construction industry.,What will Taylor want to do next?,justify the schedule's rushing,justify the costs of building,do their best,1
1222,4341,4341,4341,4341,Aubrey went mountain climbing all by herself to show her courage. She was placing her life at risk going alone.,How would you describe Aubrey?,proud,doesn't think,happy,1
1223,319,319,319,319,Tracy was relieved that her friend was alright.  She knew that Aubrey almost died.,How would Tracy feel afterwards?,there,alright,disappointed that her friend made it,1
1224,904,904,904,904,Alex threw confetti up in the air and pretty paper bits floated down and got in everyone's hair.,Why did Alex do this?,buy a bag of confetti,go to the party,show they were happy,2
1225,42,42,42,42,The customer felt that Addison was rude and made a complaint to management.,What will Addison want to do next?,take the abuse,wanted the problem fixed,explain the situation,2
1226,1670,1670,1670,1670,Alex was very shy and got uncomfortable around large groups of people.,Why did Alex do this?,was an introvert,consult a therapist,buy a book on confidence,0
1227,2682,2682,2682,2682,Cameron wore every sock that week and had to wash them again.,How would you describe Cameron?,feeling good,feeling lazy,they are ready for the next week,2
1228,3898,3898,3898,3898,Tracy was bored one Saturday afternoon. Tracy went to the mall with a friend to shop.,What will happen to Tracy?,find things to buy,hang out with Tracy at the mall,find nothing to buy,0
1229,238,238,238,238,Sydney finally beat her friend at Dr. Mario after weeks of pratice.,Why did Sydney do this?,prove herself to her friend,try to beat Sydney,congratulate Sydney,0
1230,4858,4858,4858,4858,Cameron was crying and Alex walked up and kissed her.,What will happen to Alex?,yell at Cameron,better,would be relieved to show Cameron love,2
1231,927,927,927,927,Sasha just received their pay check and had some spare money so they paid Jesse's bills.,How will Jesse feel about this?,be hugged by Jesse,be annoyed,relieved,2
1232,2992,2992,2992,2992,Ash drove to Cameron's house. Ash knew that Cameron needed a friend to help.,How would Cameron feel as a result?,indifferent,wanted,good friend,1
1233,1343,1343,1343,1343,Lee was at a concert and listened to the music.,Why did Lee do this?,drive to the concert,enjoy the concert,buy tickets,1
1234,4060,4060,4060,4060,"After the fight escalated even further, Austin left in a huff of anger.",What will Austin want to do next?,forget about everything,vent,fight Austin,1
1235,3796,3796,3796,3796,"Robin was going to Sasha's house for the first time, so Sasha gave Robin her address.",Why did Sasha do this?,clean up her house,So Robin could look for Sasha's house,So Sasha wouldn't get lost on the way there,1
1236,4134,4134,4134,4134,Alex never found out about the incident with the werewolf and the vampire.,What will Alex want to do next?,say nothing,go about their business,write a book,1
1237,3473,3473,3473,3473,Austin remembered Carson's name after having them for multiple different classes.,What will Austin want to do next?,needed to meet Carson,call Carson by their name,pick on Carson in class,1
1238,447,447,447,447,kendall signed them up for lessons even though they had no interest in doing it.,How would Others feel as a result?,listened to by kendall,like they are unheard,like they are paid attention to,1
1239,1918,1918,1918,1918,"Robin threw a large dinner party for several of their friends. At the party, Robin served food.",What will Robin want to do next?,eat the food,leave the dinner party,serve her guests,0
1240,4657,4657,4657,4657,Jan was listening to them and heard Austin's mother's yell.,How would Austin feel as a result?,very sad,very happy,very proud,0
1241,3932,3932,3932,3932,Ash didn't want to walk home alone so Kai walked with them.,Why did Kai do this?,safe,walk Ash to the door,make sure Ash gets home,2
1242,4626,4626,4626,4626,Kendall banged her head when her and Tracy were laughing together.,What will Kendall want to do next?,get a drum,record a song,say sorry,2
1243,4956,4956,4956,4956,"She had learned a ton in culinary school, Aubrey finished garnishing their breakfast.",What will Aubrey want to do next?,"double check to see if anyone has any food allergies, and if so, be sure to add those ingredients in last minute",serve everyone breakfast in the dining room,spit in their food before she serves it,1
1244,2041,2041,2041,2041,Austin got Sasha money for their birthday present that year.,What will Sasha want to do next?,give the money to Sasha,be ungrateful,thank them,2
1245,2600,2600,2600,2600,Carson gave their medicine back to the people who they had taken it from.,Why did Carson do this?,felt guilty,find a way to make it up,felt carefree,0
1246,645,645,645,645,Taylor listed the plot for sale and finally sold Jordan's land.,How would you describe Taylor?,relieved to have sold it,good at his job,bad at his work,0
1247,4437,4437,4437,4437,Cameron quit that job when she discovered that they didn't keep the machines up to code and it was dangerous.,How would Cameron feel afterwards?,like getting rehired at the job,glad for her decision,like praising the company,1
1248,2883,2883,2883,2883,Jordan managed to escape from the basement where they were being held hostage.,How would you describe Jordan?,cowardly and scared,timid and nervous,determined and admirable,2
1249,3685,3685,3685,3685,Aubrey was trying to increase her time and Alex kept their record for them.,What will Aubrey want to do next?,Ask Alex for the record,proud,Stop keeping track,0
1250,2888,2888,2888,2888,Taylor enjoys their new job. Taylor takes time to blow away the leaves before starting to cut the grass.,How would you describe Taylor?,now a front desk rep,a lawn care person,hired as a secretary,1
1251,4412,4412,4412,4412,Quinn is not very good at working with computers. The project Quinn is working on relies heavily on computers. Alex helps Quinn learn the computer.,How would Quinn feel as a result?,Confused and ungrateful,Grateful and thankful,Angry and frustrated,1
1252,1732,1732,1732,1732,"Robin had attraction to Jordan, and wanted to tell her how he felt, so he went to talk to her.",How would Robin feel afterwards?,Disappointed that he told Jordan how he felt,that Jordan will run after he tells her,Like a weight was lifted off his chest,2
1253,2510,2510,2510,2510,"Bailey was running late for work, but Bailey would make it on time.",How would Bailey feel afterwards?,had felt scared,relieved,enthusiastic,1
1254,836,836,836,836,"Jordan gave Riley the letter, letting Riley know they were breaking up with them.",What does Jordan need to do before this?,decide to break up with Riley,let the other party know they were done with them,get a pen and sharpener,0
1255,4508,4508,4508,4508,Bailey turned Aubrey away when Aubrey came to Bailey's door begging for help.,How would you describe Bailey?,bad for Aubrey,angry,cold-hearted,2
1256,2956,2956,2956,2956,Riley gave Dan a break after he worked a double shift.,What will Dan want to do next?,needed to call in a sub for Dan,needed to make time to work Dan's shift,rest for awhile,2
1257,1596,1596,1596,1596,Casey wanted to get a pet but his parents refused the request.,How would Casey feel afterwards?,depressed,very hopeful,down,0
1258,1867,1867,1867,1867,"Kai wanted to adopt a kitten, so she visited a pet shop and saw the kittens up close.",What will Kai want to do next?,pick up and hold a kitten that she likes,leave,get food,0
1259,3481,3481,3481,3481,Carson didn't want her to leave so he grabbed Quinn's wrist.,What will happen to Quinn?,become annoyed,become thrilled,become happy,0
1260,3591,3591,3591,3591,Skylar and Quinn have been married for a while. Skyler started working 3 jobs to increase household income. Skylar kept Quinn from becoming a waitress.,How would Skylar feel afterwards?,proud to be a bread baker,proud being a breadwinner,felt useless,1
1261,1509,1509,1509,1509,Carson took their lumps and threw them in the garbage.,How would Carson feel afterwards?,quite horrible,very nice,very serving,0
1262,3880,3880,3880,3880,Aubrey was taking the bus to work each day but she wanted a working car more than anything.,What will Aubrey want to do next?,start begging people for money,start looking at cars online,save money in order to buy a car,2
1263,3988,3988,3988,3988,cameron needed to make a fruit drink so he put fruit in the blender.,What will Cameron want to do next?,watch the blender work,forget about the blender,eat healthier,0
1264,3349,3349,3349,3349,Bailey saw her friend in the window and invited their friend inside but their friend declined the invitation.,How would Bailey feel afterwards?,like her friend does not like her,wanted and desired for her friendship,outgoing,0
1265,2437,2437,2437,2437,Bailey had been offered a deal on her failing business. Casey urged Bailey to accept the deal.,Why did Casey do this?,give good advice to Bailey,sabotage Bailey's future potential,sell the business,0
1266,3448,3448,3448,3448,Remy was in big trouble from her principal for the act.,How would Remy feel afterwards?,Elated,Proud,Ashamed,2
1267,1567,1567,1567,1567,After Jordan's father died Jordan took her to Hawaii for a break from everyday life.,The others would feel how about this?,a fatherless person,outraged,pleased,2
1268,3086,3086,3086,3086,Alex never would have found out if he hadn't found the love letter his wife sent to someone else.,How would Alex feel afterwards?,loved,clever,betrayed,2
1269,3883,3883,3883,3883,Alex loved their cousins bodies and grabbed one of them by the crotch.,Why did Alex do this?,grow fond of the cousins,was immoral and thought he would imitate President Trump,grow possessive of his cousins,0
1270,696,696,696,696,Tracy was the commander of Lee army.,Why did Tracy do this?,a hard worker,was qualified for the job,rise up the ranks,1
1271,90,90,90,90,Aubrey sent text messages to remind the group about the meeting this afternoon.,What does Aubrey need to do before this?,get everybody's email addresses,find out the meeting time,be certain that no one was late,1
1272,1422,1422,1422,1422,Addison was driving to their house and stopped so they could get lunch for themselves.,What does Addison need to do before this?,start the car,ask about lunch,Pay for the meal,0
1273,839,839,839,839,Robin took a lot of time out of her day to help Jesse.,How would Jesse feel as a result?,bitter,annoyed,grateful,2
1274,3425,3425,3425,3425,Carson went to talk to his wife about their anniversary plans and she was excited to go away.,What will happen to Carson's wife?,make his wife happy,make reservations,stay home,1
1275,102,102,102,102,"After months of preparation, Lee finally managed to kill their wife.",What does Lee need to do before this?,needed to research how to hide a body,needed to get advice from their friends,needed to consult with their priest,0
1276,1348,1348,1348,1348,Bailey put the luggage in their car so that they could go on the vacation.,How would Bailey feel afterwards?,excited for vacation,done,disappointed about the vacation,0
1277,2577,2577,2577,2577,After being injured in an accident Lee was entrusted into Cameron's care until he got better.,What will Lee want to do next?,work hard to get better,make sure he stayed hurt,tell Cameron to leave him alone,0
1278,827,827,827,827,Ash needed more room and moved Cameron over an inch.,What does Ash need to do before this?,walk away,stay still,gently shove Cameron over,2
1279,4253,4253,4253,4253,While getting ready for bed Kai took their hat off to sleep.,How would Kai feel afterwards?,unsteady about bedtime,someone who likes wearing hats,ready for bed,2
1280,4778,4778,4778,4778,Cameron asked Jan's roommate for advice because they were confused.,Why did Cameron do this?,Be a bad friend,Get good advice,Get bad advice,1
1281,3461,3461,3461,3461,"After living with Austin for many years but having to be given away, Remy the cat was happy to see Austin.",How would Remy feel afterwards?,happy that he got to see his old owner,abandoned because Austin gave him away,better,0
1282,2154,2154,2154,2154,Sydney shielded her eyes from the sun while laying out on the beach.,How would you describe Sydney?,enjoying her sunglasses,relaxed and warm,snow blind,1
1283,1664,1664,1664,1664,Jesse took his girlfriend along. She wasn't happy that he was going to leave without her.,What will Jesse want to do next?,apologize to her,say nothing,Jessie did this because his girlfriend disagreed with his plan,0
1284,3475,3475,3475,3475,Kendal knew he had drank to much to drive home from the party and yet took another drink.,What will Kendall want to do next?,get drunk,pay and take a taxi home,walk home staggering in the streets,1
1285,3579,3579,3579,3579,Skylar ignored Remy's mother by running off to the toy section of the store and was grounded as a result.,How would Skylar feel afterwards?,like she was a bad child,happy she was caught,grateful to Remy's mother,0
1286,3956,3956,3956,3956,Tracy liked to drink a lot in  any ocasion.,How would you describe Tracy?,drunk,sleepy,someone with alcohol problem,2
1287,4180,4180,4180,4180,Alex put Jordan into practice. They were a good player.,How would Jordan feel as a result?,like a good coach,part of the team,ashamed of themselves,1
1288,2462,2462,2462,2462,Sydney looked at their nose and noticed that it was crooked.,How would Sydney feel afterwards?,Dissapointed,worried about appearances,Happy,1
1289,4877,4877,4877,4877,Riley stopped teasing Lee after she saw how upset and hurt they were.,How would Riley feel afterwards?,Bad for not being tougher on Lee,empathetic,like they should make it up to lee somehow,1
1290,4357,4357,4357,4357,Sasha sent her son to college in the fall of that year.,What will Others want to do next?,ok,help her son move in,Give him support,2
1291,2412,2412,2412,2412,Sasha gave Aubrey a silly look and made their friend laugh.,How would you describe Sasha?,elated by the action,loved by Sasha,As someone that can be silly,2
1292,831,831,831,831,"Carson did not want to make a big deal out of their score, so Carson placed the ranking in perspective.",How would you describe Carson?,sad,angry,a modest person,2
1293,4237,4237,4237,4237,Taylor took Carson's turn while Carson was in the bathroom.,What will Taylor want to do next?,take his own turn,are nice,tell Carson the truth,2
1294,3639,3639,3639,3639,Jesse wrote the wrong answer on the board and the teacher yelled at him.,How would Jesse feel as a result?,as normal,happy,angry,2
1295,3563,3563,3563,3563,Skylar adapted to Jordan's environment even though it was different.,How would you describe Skylar?,a good friend,mean,rude,0
