,Unnamed: 0,Unnamed: 0.1,Unnamed: 0.1.1,sent1,sent2,ending0,ending1,ending2,label
4301,4301,4301,4301,Sydney shooed it away when the puppy crawled up to her.,How would you describe Sydney?,loving,guilty that she rejected the puppy,unkind,2
3465,3465,3465,3465,Addison found the movie funny enough to recommend to all of their friends.,What will Addison want to do next?,send messages,tell them of a movie they'd like,share a movie she liked,2
2007,2007,2007,2007,Jan had been really busy with their sick kid so Quinn went out and bought the stuff Jan needed.,How would Quinn feel afterwards?,that he made Jan happy,that Jan owed him,that he shouldn't have done it,0
2404,2404,2404,2404,"Carson got his wish, and all the people loved them and no one else.",How would you describe Carson?,self-sacrificing,blessed,someone who has a huge ego,1
2308,2308,2308,2308,Robin asked Remy for Alex's number. Alex didnt want to talk to Remy and asked who had given Remy his number.,What will happen to Robin?,ashamed,punch Alex,apologize to Alex,2
2401,2401,2401,2401,Cameron took their chance with the dice and won some money at the casino.,What will Cameron want to do next?,use all the winning money and her money to keep playing,go to a casino,try again,2
4910,4910,4910,4910,Austin made Addison an announcement because he wanted to help her out.,What will Austin want to do next?,yell at Addison,back out of what he said,satisfied,1
3815,3815,3815,3815,Kai felt lonely so he went to Casy's room and laid by Casey's side. Casey was sound sleeping.,How would Kai feel afterwards?,warm and relieved,upset and scared,responsible and guilty,0
2060,2060,2060,2060,Bailey cooked all day to provide a meal to the family members after the deacon's funeral.,How would Bailey feel afterwards?,angry that the family wasn't provided for,exhausted from all of the hard work,full from the meal,1
3756,3756,3756,3756,Sydney swam at the local pool and splashed and had a lot of fun.,What does Sydney need to do before this?,cool off,go to the pool,enjoy herself,1
3491,3491,3491,3491,Sydney started the first day of their first job yesterday.,How would Others feel as a result?,lost,mature,a new employee,2
3548,3548,3548,3548,Robin put their finger on the ball so that someone could come up and kick it.,What will Robin want to do next?,wanted to score a field goal,wait for the kicker,kick the ball,1
3955,3955,3955,3955,"As part of the pagan religious ceremony, Aubrey offered themselves to the gods.",What does Aubrey need to do before this?,find the gods,be very devout,be a sacrifice,1
1811,1811,1811,1811,Kendall played pool with Ash's dad even though Ash didn't want the two of them to talk.,What will Ash want to do next?,yell at Kendall,thank their Dad,spend time with Ash's dad,0
357,357,357,357,"Remy was a star student in her class, and knew everything on the test.",What will Others want to do next?,study with Remy,ignore Remy's advice,do well on the test,0
705,705,705,705,Taylor acted as Remy's agent in the business deal so that he would be treated fairly.,What will happen to Remy?,get Remy the best deal,be represented,earn Remy's respect,1
2106,2106,2106,2106,Jesse was not able to pay their phone bill for a while. Jesse changed their number.,Why did Jesse do this?,pay his bill,be secret,be in touch,1
2675,2675,2675,2675,For the upcoming camping trip Jan decided to buy camping supplies from a store because she was a first-time camper.,How would Jan feel afterwards?,resentful towards whoever forced her to do this,annoyed that she had to pay for supplies,nervous about camping for the first time,2
2423,2423,2423,2423,Remy wasn't being careful and got tangled up in the cord.,What does Remy need to do before this?,be cautious with the lights,put lights on the tree,break the cord,1
1105,1105,1105,1105,Carson was evicted from their apartment for coming in drunk all the time and waking everyone up.,How would Carson feel afterwards?,was real upset and so he decided to give these hypocrites a little surprise and he poured oil on the walls,alcoholic,was real upset and he decided to go to a think tank and get some help and dry out,2
2422,2422,2422,2422,Cameron ran a red light which resulted in a accident that killed his son.,What will the police want to do next?,investigate if Cameron was texting,cry in pain,pray for forgiveness,0
96,96,96,96,jesse was bored so he saw if he could help the person out.,How would Others feel as a result?,as thankful,caring and kind,as ungrateful,0
339,339,339,339,Casey asked Jesse to consult on their business plan.  Jesse increased Casey's profits.,What is Casey likely to do in the future?,keep working,Ask Jesse for more business advice,work hard,1
1170,1170,1170,1170,Casey looked all over their house for the missing remote and it was in the sink.,Why did Casey do this?,bored,sit down and watch tv,smart,1
4333,4333,4333,4333,Remy kept to themselves a lot and didn't have friends. Remy played a lot of chess online.,What will Remy want to do next?,keep playing chess,win the chess,find a new game,0
1709,1709,1709,1709,Bailey felt Jesse needed help but she didn't want to ask.,What will Jesse want to do next?,fess up and ask for help,Never get help,talk to Jesse's friends if he's ok,0
1319,1319,1319,1319,Ash had been mouthing off to a security guard at a club.,What will Ash want to do next?,fight back,call the police,speak to a manager,2
4580,4580,4580,4580,Lee had been feeling down lately so Remy decided to try to make Lee feel better.,What does Remy need to do before this?,know what Lee likes,buy a gift,improve Lee's confidence,0
4929,4929,4929,4929,"Taylor had always had a lot of influence on Aubrey, so no one was surprised when Taylor led her to join the army.",How will Taylor feel>?,powerful,be unhappy doing something not right for them,be happy to serve with their friend,0
749,749,749,749,Sydney diagnosed Riley with a sinus infection and wrote a prescription.,What does Sydney need to do before this?,needed to observe the patient,needed to not have gone to medical school,take the medication,0
461,461,461,461,sydney was boerd so she fed their dog.,What does Sydney need to do before this?,refuse to feed the dog,think about the dog food,learn about the dog's owners,1
2715,2715,2715,2715,"quinn yelled at kendall and explained the gravity of the situation, so kendall gave quinn their attention.",How would you describe Kendall?,as upset,guilty,as happy,1
1984,1984,1984,1984,Austin did not want to leave the party without a ride because they were drunk.,What will Austin want to do next?,ask someone to drive them home,call a taxi,find the keys to their car,1
1771,1771,1771,1771,"Sydney never made anything, and one day her grandmother showed her how to make a cake.  It turned out well.",How would Sydney feel afterwards?,proud,lazy,embarrassed,0
358,358,358,358,Addison gave their dogs some water so they would feel better and be happier.,What will Others want to do next?,buy a home,watch the dogs,fill the water bowl,1
4743,4743,4743,4743,Sasha went to high school for four years. Sasha graduated from high school.,Why did Sasha do this?,have a job,get married,needed to attend class,0
1662,1662,1662,1662,Alex called the school to let them know that their child was sick and won't be in for the day.,What will Alex want to do next?,avoid worrying people,Go to the park,Schedule and appointment,2
2071,2071,2071,2071,Sydney went home to eat instead of going to the restaurant.,What will Sydney want to do next?,going home,eat next,dance next,1
1099,1099,1099,1099,Lee accepted that they had made a serious mistake. Lee made their bed and lied in it.,Why did Lee do this?,ignore their mistake,make up for the mistake,learn from their mistake,2
4121,4121,4121,4121,Ann smiled at Quinn.  Quinn also gave a smile.,What does Quinn need to do before this?,see Ann,start a conversation,introduce themselves,0
4252,4252,4252,4252,Jesse went to the zoo with her family and they got tickets for the orca show as well.,What does Jesse need to do before this?,wanted to show her family the orcas,get tickets before this,call in sick before this,0
545,545,545,545,Alex wiped Remy's eye with a tissue because they were crying for hours.,How would Alex feel afterwards?,like they care,compassionate and courteous,like a bother,1
3868,3868,3868,3868,Skylar ate breakfast with their family during the time she was visiting.,What will happen to Skylar?,join her for breakfast,eat breakfast too,friendly,1
2976,2976,2976,2976,Jordan was going through his closet trying to decide on keeping some things. Jordan got rid of it altogether.,How would Jordan feel afterwards?,proud,bad,indecisive,0
3817,3817,3817,3817,Cameron made Bailey's jaw drop when he quit his job that day.,How would you describe Cameron?,would be in shock,quite courageous,very bored,1
564,564,564,564,Jesse shared Jordan's love for cats and asked her to a cat cafe.,What will happen to Jesse?,go out with Jorden,go out with Jordan,go on a date with Jorden,1
352,352,352,352,Bailey turned Aubrey away from the ride because she wasn't allowed.,How would Bailey feel afterwards?,left out,generous,like he was a jerk,2
1032,1032,1032,1032,Jordan told Tracy to get the keys so they could drive the kids to school.,What will Tracy want to do next?,get the keys,Needs to get the kids ready,Puts the kids into the car,0
1296,1296,1296,1296,Aubrey found some shade under the tree and sat down for a rest.,What does Aubrey need to do before this?,take a nap,wear a raincoat,hike across a meadow,2
2005,2005,2005,2005,Ash needed money fast and decided that committing a crime was their only choice left.,How would you describe Ash?,angry about not having options,worried about committing a crime,running out of options,2
1720,1720,1720,1720,"After forgiving men for their sins, Jesse decided to pray and eat a fish.",How would you describe Jesse after forgiveness?,decided to pray for fish,decided to forgive men,decided to pray,2
4467,4467,4467,4467,"Jordan secretly laid eyes on Ash, his secret crush.",How would Jordan feel afterwards?,likes Ash,longing,super,1
2752,2752,2752,2752,Sasha started acting just like Kendall after realizing Kendall was getting asked out a lot.,What will happen to Kendall?,get asked out,help Sasha find a date,get a boyfriend,1
4196,4196,4196,4196,Riley and Sydney started their own band where Riley was the main singer and Sydney was the drummer however Sydney liked to join in singing with Riley.,How would Sydney feel as a result?,embarrassed,happy,resentful,1
1492,1492,1492,1492,Sydney kept Addison entertained so that she wouldn't ntoice her parents weren't home.,What will happen to Addison?,grow up,be sad,cry,0
2747,2747,2747,2747,Austin was doing the laundry and washed Kendall's sheets.,What will happen to Kendall?,thanks Austin for helping,be appreciated,buys new sheets,0
3050,3050,3050,3050,Jan served the company well.  They were appreciated by others.,Why did Jan do this?,thank people in the company for the appreciation,fulfill their duties,for fun,1
4249,4249,4249,4249,"The phone wouldn't stop ringing, after realizing no one else was going to answer Carson picked up the phone.",What is Carson likely to say?,Stop calling me,get off the chair,How can I help you,2
2560,2560,2560,2560,Jordan found Jan's wallet and gave it back to them.,Why did Jordan do this?,Because Jan thinks they should have their wallet,Because Jan doesn't want to lose their wallet,Because Jordan doesn't want Jan to have to worry,2
2400,2400,2400,2400,Lee decided to make an online website for the practice. Lee helped their practice this way.,Why did Lee do this?,make sure the online website works correctly,find other ways to help the practice,wanted to gain more customers,2
2324,2324,2324,2324,"After several days of arguing with the boss, Bailey finally was exhausted. Bailey let it be.",How would Bailey feel afterwards?,happy that the boss reconsidered,amenable,ignored and defeated,2
4109,4109,4109,4109,Addison sailed her boat without any help from her dad.,How would Addison feel afterwards?,unable afterwards,capable afterwards,courageous,1
4551,4551,4551,4551,Bailey searched high and low for her chemistry book from school.,How would you describe Bailey?,anxious,calm,unphased,0
3778,3778,3778,3778,Kai threw flowers into the water as the funeral pyre drifted away.,What will Kai want to do next?,cry for someone,push someone in the water,jump into the water,0
423,423,423,423,Carson and Jan are in a relationship. Carson dictates everything Jan does.,How would Jan feel as a result?,authoritative,trapped,powerful,1
4439,4439,4439,4439,Jan introduced Bailey to herbal medicine in hopes to improve Bailey's lives.,How would Bailey feel as a result?,good for Bailey,The herbal medicine made her very thirsty,young again,2
4865,4865,4865,4865,Cameron did their job well and was proud of their work.,What does Cameron need to do before this?,do good work,work hard,of done the work,0
1568,1568,1568,1568,Quinn was visiting the city so Riley took them up to the tallest building to get a view.,Why did Riley do this?,wanted to be a good friend,show Quinn the skyline,wanted to be alone,1
3393,3393,3393,3393,Jesse wrote a love song and sang it in front of the bar while their girlfriend was watching.,How would you describe Jesse?,an artistic person,a showoff,proud,1
540,540,540,540,Sydney let a secret slip that didn't belong to her and she knew was going to be in trouble if Riley finds out.,What will happen to Sydney?,be in trouble,relieved,never trust Sydney again,0
1004,1004,1004,1004,It was Cameron's birthday at school today. At lunch Cameron gave the class their snacks to celebrate.,Why did Cameron do this?,enjoy a snack,wanted to be nice,celebrate his birthday,2
614,614,614,614,"Remy was on a first date with Jordan, alone in their apartmen,t when they saw lust in Jordan's eyes.",How would Jordan feel as a result?,nervous,cautious about moving too fast,forlorn,1
4624,4624,4624,4624,"After hiring Jordan to lead the new marketing department, Ash implemented Jordan's suggested program.",Why did Ash do this?,working well,try Jordan's suggestion,distrust Jordan's advice,1
3190,3190,3190,3190,Kai gave people hope when he showed them she was Superman.,What will Others want to do next?,inspire other people,impress other people,save the day,0
55,55,55,55,"The boxes were in the doorway, so Alex moved the boxes from the doorway.",Why did Alex do this?,so they wouldn't be in the doorway,see the boxes,so they wouldn't be stolen,0
4432,4432,4432,4432,Jesse pulled Kendall towards the amusement park ride but he was very scared.,What does Jesse need to do before this?,keep pulling kendall toward a ride,reassure him,go on a ride,1
3559,3559,3559,3559,Skylar wanted to get an after school job. Skylar took notice of the opportunities listed on the job board.,Why did Skylar do this?,wanted to have responsibility,copy down contact information for jobs listed on the job board,submit job applications,1
3554,3554,3554,3554,"She told Sasha that she did not get to celebrate her birthday, so Sasha took her to Vegas.",What will Sasha want to do next?,go to sleep in Vegas,shop in Vegas,celebrate with her and Sasha,2
3517,3517,3517,3517,Bailey told Kendall they were done when they got to the last question of the assignment.,What will Bailey want to do next?,tear up the assignment,answer all of the other questions,turn in the assignment,2
4281,4281,4281,4281,Austin opened Tracy's purse wide. Tracy caught Austin in the act this time.,How would Tracy feel as a result?,trying to steal stuff from Tracy,loved by Austin,very angry,2
1724,1724,1724,1724,Remy ask Jan to clean up the mess of toys. Jan does it without being asked again.,How would Remy feel afterwards?,happy,violent,broken,0
2716,2716,2716,2716,"After winning first prize in a contest, Carson recieved praise from others.",How will others feel next?,Others will want Carson to work harder,thank the others,Others will look up to Carson,2
2162,2162,2162,2162,Casey's programming error cost Casey's business thousands of dollars.,How would you describe Casey?,clueless,in need to better help,blessed with great employees,0
816,816,816,816,Bailey worked at night and went to the store early in the morning.,How would you describe Bailey?,happy to be done with work,tired and ready for bed,busy,2
3504,3504,3504,3504,Cameron got mad at Sam because he wouldn't give her back her pencil.,How would you describe Cameron?,ticked off,angry at Sam,mad at Sam,0
1669,1669,1669,1669,"Out of breath and winded, Tracy finally came within sight not far off from the finish line.",How would Tracy feel afterwards?,burdened by the last hurdle,committed,near,1
3751,3751,3751,3751,Bailey loved Aubrey's job and made a plan to steal it from her.,What does Bailey need to do before this?,quit her job,steal some files,kiss up to Aubrey's boss,2
3158,3158,3158,3158,Tracy got their passport and was able to travel internationally for the first time.,What will Tracy want to do next?,fill out the passport application,get passport photos done,fly to Europe,2
2582,2582,2582,2582,Jesse took my girlfriend soup because she wasn't feeling well.,How would Jesse feel afterwards?,understanding that my girlfriend needed to soup when sick,cared for,better,0
3860,3860,3860,3860,"California cost of living was to high for Sasha.  Therefore, Sasha left and went to Texas.",What will Sasha want to do next?,find a job,find a place to live in Texas,a job come to her,1
2169,2169,2169,2169,"Sasha was talking to Robert, who Riley was in love with, so Riley stared at Sasha with jealous eyes.",How would you describe Riley?,ashamed,was blonde,was suspicious,2
209,209,209,209,Casey rolled onto Taylor's back while they were play fighting on the floor.,Why did Casey do this?,play with Taylor,hurt Taylor,win the fight,0
4530,4530,4530,4530,Taylor gave Lee's son food and it was a burger with some fries.,What will happen to Taylor?,get some meal from Taylor,loved,receive some food from Taylor,1
4345,4345,4345,4345,Ashe worked very well and was asked to join the team.,How would Ash feel afterwards?,included afterwards,diligent,professional,2
878,878,878,878,Cameron was struggling financially so Ash paid Cameron's bills to keep them afloat and not lose their tenancy.,What will happen to Cameron?,they will help Cameron,be thanked,keep their tenancy,2
2158,2158,2158,2158,Quinn gave cookies to Austin's parents after Austin told Quinn that they would like them.,What will Austin want to do next?,Find out they liked cookies,return the favor to Quinn,Find out what kind they liked,1
763,763,763,763,"Looking at beautiful antiques in the shop, Ash accidentally bumped them and they fell to the floor.",How would Ash feel afterwards?,worried about ash,clumsy,graceful,1
3758,3758,3758,3758,Aubrey wasn't paying attention and forgot the car keys in the ignition.,What will happen to Aubrey?,blame Ash,get locked out of the car,call AAA,1
1268,1268,1268,1268,Carson told Cameron and Cameron's sister about the meeting for the new club they were forming.,What will happen to Cameron?,go to the meeting,want to Join the club,take Cameron with,1
3015,3015,3015,3015,Lee met a guy and she wanted her friends to meet him.,What will Others want to do next?,introduce her friends to the guy,ask him questions,take the fellow to see her friends,1
1186,1186,1186,1186,Sydney noticed a bad smell in the school.,How would you describe Sydney?,observant,should tell a teacher about the smell,feeling very bad,0
965,965,965,965,Riley threw away the scraps but then realized that the dog could have eaten them.,How would Riley feel afterwards?,good,wasteful,brave and courageous,1
2530,2530,2530,2530,Skylar told Taylor to come back home for dinner when it was ready.,How would Taylor feel as a result?,go home,mad,tell Taylor to come home,0
3438,3438,3438,3438,"After completing his mandatory math courses, Lee took advanced calculus in high school.",Why did Lee do this?,do well in math,become an English major,receive credit for the extra course,2
3339,3339,3339,3339,Carson shuffled the cards before getting ready to play a card game with friends.,What will Carson want to do next?,split the deck in half,shuffle the cards more,Let his friends into his house,0
931,931,931,931,Quinn gave them all one to enjoy because it was snack time.,What will happen to Others?,they will eat,they won't eat,they will be hungry,0
1809,1809,1809,1809,Sasha cut Cameron's hair herself and looked great for the whole group.,What will happen to Sasha?,proud,bored,keep getting cuts from Sasha,0
1059,1059,1059,1059,"Because Bailey wanted to qualify for student loan forgiveness, she made sure to jump through all of the bureaucratic hoops.",How would you describe Bailey?,prepared to receive loan forgiveness,motivated to get loan forgiveness,somebody with student loans,1
3032,3032,3032,3032,Sydney sent coins flying on the earth after finding the coins to spread.,How would you describe Sydney?,nice,useless,horrible,0
1387,1387,1387,1387,Lee gave their speech to the audience about the climate topic.,How would Lee feel afterwards?,Good for being heard,feeling proud,Like they could give the speech,0
4293,4293,4293,4293,Lee brought the murder case to a conclusion with good evidence against the defendants.,What will happen to Others?,be imprisoned,be told he did a good job,be thanked by his client,0
4074,4074,4074,4074,Kendall saw fleas on their dog and got some medicine. Kendall killed every flea.,What will Kendall want to do next?,alright,see if the dog needs follow-up,check for fleas,2
2117,2117,2117,2117,Kendall had Skylar's back and made sure nothing happened to them.,What will happen to Kendall?,have their back,grow closer to Skylar,become enemies with Skylar,1
2245,2245,2245,2245,Taylor talked to Jesse in class and got Jesse in trouble.,What will Jesse want to do next?,try and get out of trouble,think about an apology from Jesse,be forgiven by Jesse,0
4417,4417,4417,4417,Skylar's parents were millionaires so Skylar is waited upon hand and foot.,How would you describe Skylar?,great,relieved,spoilt,2
2293,2293,2293,2293,Cameron broke my leg on purpose by hitting me hard with a hammer.,What will Others want to do next?,get me to the hospital,hit Cameron with a hammer,break my nose,0
4468,4468,4468,4468,Jordan went out back and was getting in his car when he found Jan's keys.,What will happen to Jordan?,get a hug,be relieved to get their keys back,get yelled at,0
3766,3766,3766,3766,Addison gained a lot of weight because they had a major sweet tooth.,How would Addison feel afterwards?,indulgent,as content,as calm,0
1102,1102,1102,1102,"Jesse's car wouldn't start, so Ash complied with Jesse's desperate request to drive them to a job interview.",How would Ash feel afterwards?,Thankful their car was running,Like hiring Jesse for the job,Thankful that Jesse drove there,0
1938,1938,1938,1938,Quinn surprised the kids with a party because they had been really good.,What will happen to Others?,learn about parties,have fun,ask about fun,1
4637,4637,4637,4637,Sydney told Bailey's grandma she always wanted to be in a parade.,How would Bailey feel as a result?,Like they had a conversation with their grandma,Like they thought about their grandma,performative,0
690,690,690,690,Carson threw a bone to their dog as hard as he could trying to hurt the dog.,Why did Carson do this?,feed the dog,play with the dog,attack the dog,2
1216,1216,1216,1216,Quinn was in a hurry to get to work and forgot if he had locked the door so he had to go back to double check.,What does Quinn need to do before this?,locked,walk up to the door of his house,wanted to make sure thieves couldn't break in,1
1429,1429,1429,1429,Sasha is an animal activist. One day they went to the zoo for an animal rights protest.,What does Sasha need to do before this?,join the activity,participate the protest,an animal activist. One day they went to the zoo for an animal rights protest,0
3207,3207,3207,3207,Riley cried in their beer bowl at the bar after getting fired from her job.,What does Riley need to do before this?,reflect on why she got fired,write mean things about her boss,figure out what bar to go to,2
4248,4248,4248,4248,Riley led Jordan to the door and asked him to leave her alone.,What will happen to Jordan?,put their head on their desk,get angry at Riley,lay on their bed,1
1367,1367,1367,1367,"Jesse had made breakfast for two that morning, so when Sydney woke up, Sydney ate Jesses breakfast.",How would you describe Sydney?,was angry,was sleeping,was pleased,2
825,825,825,825,Jan was having trouble seeing in school. Jan expressed their concern.,What will Jan want to do next?,focus harder,look harder,get glasses,2
3232,3232,3232,3232,Robin found none of her items for sale in the local store and decided to take action.,What did Robin do next?,ok some of her items to the store clerk and asked her to share them with the manager,make their items better,do better,1
3483,3483,3483,3483,Lee had nothing better to do so he went with Addison to the store.,What will happen to Addison?,have some company,go alone,be lonely,0
2667,2667,2667,2667,Ki put the bag on the table so he wouldn't forget it in the morning.,How would you describe Kai?,prepared,ki who has forgetted,careless,0
1252,1252,1252,1252,Alex drove cautiously down the road because Alex had recently been in an accident.,What does Alex need to do before this?,decide to be a safer drive,speed to get where they're going,drive as they always do,0
1625,1625,1625,1625,Austin drove home at night after working all day.,Why did Austin do this?,wanted to be lazy,wanted to go home,relax on the couch,1
2222,2222,2222,2222,"After being whined at for days, Kai finally told their kids no.",What will Others want to do next?,stick with their decision,teach their kids to beg,teach the kids a life lesson,0
